"","Heading","Text","Rating","Time"
"1","Great product for a first time Apple user","I've never owned an Apple product but this year I took the plunge to move from Android (Pixel phones, Samsung phones) to get this iPhone 11. It was the right time for me to do so. With the changes and improves iOS13 brings (from all that I've read and watched in reviews/vids) and the camera upgrades from XR; the transition has been fairly easy. I know there is a learning curve for me as I slowly learn the iOS system. But I changed to have the best of both worlds. And it is true the Google apps in iOS do run better than on Android.

The phone performance has been stellar. NO lag. NO freezes. I had prepared myself to have a smooth experience with iOS, but I have still been surprised and pleased with the fluidity. Never have I experienced anything so smooth on any of the many Android phones I've used over the years. The battery is a superstar champ. It feels as if I cannot kill it if I were to try. Even though I am never far from a charging option, it is so refreshing to not feel battery anxiety.

Siri is WAY better than I was led to believe. In fact I find her to be more responsive and less buggy than Google Assistant - especially when using Apple CarPlay. This was a surprise to me due to all I've read. Voice to text is admittedly not as accurate as Assistant. 

I already knew the iPhone cameras take the best videos, but the updates to the photos themselves are phenomenal. The auto night mode is fantastic - I like it better than Pixel's Night Sight. It seems more natural. True the Portraits are sometimes not as well defined as on the Pixel phones - but that is something that is not a game changer for me. I like the fact that photos on the iPhone 11 are not over sharpened as is true on the Pixel lineup (I've had all 3 Pixel phones so I'm not spinning my wheels here).

True tone is fantastic. The color (mint green) is the prettiest color I've had on a phone. I have no issues with the LCD screen versus OLED - it's a great screen. The gestures are great and smooth and easy to learn. 

I've been so pleased with this that I'm not looking at (researching) buying one of the Macbook laptops (tablets are not for me). 

This is a fantastic phone. No looking back.",5,2019-10-06 11:43:00
"2","Very good phone and camera","High quality phone that still has about 50 % charge at the end of the day. Very good camera especially if you edit with Camera+.",5,2019-10-18 18:21:00
"3","Bought 2","Wife needed one bought her and I one. Love low light camera function",5,2019-12-07 08:13:00
"4","Love it","I’m already an iPhone user for many years. But really impressed with how much easier it is. Camera is much better. Longer battery life! Much more memory! Love it!!!",5,2020-01-18 17:46:00
"5","Amazing pics and footage!","Love my new iPhone 11! It’s fast and the camera is amazing. Video quality is excellent.",5,2020-01-03 16:22:00
"6","Great phone for the price","This review is based on upgrading from an iPhone X to an 11, hopefully it helps those who are in the same situation. 
There were a few reasons I chose to upgrade, I wanted a slightly bigger screen, I wanted better battery life, and I wanted better speed (I play quite a bit of games on my phone). I had also made the mistake of getting an X with only 64gb which was a bad idea to begin with. This phone fortunately covers all those issues. The battery life is great and the speed at which this phone opens apps is incredible. The camera with the wide angle is also a big bonus, I’ve never been a big photographer with my phones, but I’ve found myself using this phone a lot more for that purpose.
The one downside to this phone is the quality of the screen, this is more evident with the new dark mode in iOS13. Black screens on this phone aren’t really black, they’re more of a dark grey and this is due to the OLED vs LCD screen.
I still own my X and once I upgraded it to iOS13 I could see the difference in dark mode, on my X the black backgrounds seem truly black while on the 11 the blacks seem a little lighter. Does this make the upgrade not worth it? I guess it depends how much the lighter blacks bother you. Personally, after a month of use I don’t notice it much anymore.
At $749 for the 128gb I would highly recommend this phone, if the LCD screen bothers you that much then I would recommend going for the Pro but at the price point I’m not sure extra deep blacks are worth it.",5,2019-10-21 13:03:00
"7","Fantastic upgrade","Upgraded to the 11, 128gb from an 8+ 256gb. Never needed 256 with the 8+ But that was the next size up from 64gb. 128gb is perfect. I’m able to keep all of my photos and all of my music on this phone with 60+gb left. A lot of talk about how the pro screen is so much better than the 11’s LCD screen. But going from the 8+ that already had an LCD, this screen seems sharper and more vibrant. The thing that really stands out is the speed. This thing just flies. I can click a link or open a new app and it loads almost as quickly as snapping your fingers. The camera on the 8+ was already pretty good, but again the 11 shines better here. I love the wide angle lense and the night mode. I used to hate taking low-light pics due to the flash making things seem so white. What I like most is gaining some screen size compared to my 8+, but in a smaller form factor. Overall I am extremely satisfied with my upgrade and would definitely do it again. For most people, the iPhone 11 is the upgrade that is worth every penny!",5,2019-09-22 16:19:00
"8","A screen I can see without the bulk of a PLUS","I left a 7 for this 11. It gives me a visual screen that I can see without the bulk of the iPhone 7+ which my husband is very happy with. 

It’s taken a bit to get the hang of it but I had excellent help getting started with the help of Joshua in the mobile department. Later I went back in to my geek Michael who went step by step through the questions that had cropped up. 

If you haven’t used anything past iPhone 8 be sure to play around and make a list of what you’re stuck on. Take it to mobile or geek squad. If it’s easier, call Apple. 

Enjoy your new iPhone!!!

Very important to me is that this phone doesn’t have the OLED screen. I’m extremely light sensitive and get migraines. This is the only phone I can use. If Apple  switches to all OLED screens in the future I’m off iPhone.",5,2019-09-27 15:30:00
"9","Amazing camera","The only thing that really sperates phones these days seems to be the cameras. I had a pixel 2 xl (now on galaxy s10e) which takes the best pictures. My wife bought the iPhone 11 and I am thinking about switching to it. The camera is AMAZING. Battery life is great and the new iOS adds a lot of shortcuts that apple was missing. For 699 apple hit a home run with this phone. Even tho the screen is lower resolution the colors and brightness are astounding. I'm not an Apple fan but may be...I just haven't switched yet because I still love Android but I'm on the fence.",5,2019-10-13 09:22:00
"10","Best iPhone to this day! Right size right price.","The iPhone 11 is an amazing phone. I had a XS Max before, and traded it in to get this, and I am so happy I did. This is what I consider the “Goldilocks” iPhone; it’s just right. The size, both screen and body, is perfect, being in between the 11 Pro and Pro Max. It’s not as good a screen as the Pro’s OLED, but it’s still pretty darn good. The colors are amazing and it still is a very high-definition screen. Why spend extra for a better screen? You’re getting the same processor, which is wicked fast, and ALL the same features as the Pro! I am so glad that I switched from the XS Max because I can enjoy all of the same great features of the Pro model for a fraction of the cost. I would HIGHLY recommend considering buying the 11 over the Pro series.",4,2019-09-29 17:16:00
"11","Love it! It’s easy to use. Nice!","Not a big stretch from my previous iPhone as far as understanding how to use the functionality. I’m happy with this phone. Thanks WBHauser",5,2020-01-17 19:22:00
"12","I phones  keep getting better","Started off with a iPhone 4 then thru the years kept upgrading up to the new iPhone 11.  I really must say the iphone 11 knock it out of the park!  Very user friendly and easily adaptable even for the beginner. Battery life is alot better then my previous phones. Thank you iPhone and Bestbuy.",5,2019-10-13 10:41:00
"13","This was a pre order","I’m sure this is a great phone but I cancelled it the very next day when I discovered the 128gb was only $50 more. I could easily have stayed with the 64gb since I only used 32gb of my 128gb iPhone 7. It’s just that I got used to the security of having plenty of space. 

I ordered the red (instead of the purple that I really like) because 100% goes to fighting Aids. I will always choose a product that supports a charity.",5,2019-09-20 16:48:00
"14","my first iphone","this  is my first iphone, been a samsung owner since the S4 came out, it's a great phone, love how it picks up wifi where ever i am, no signing in to networks. i got the 11 because i'm a photographer, it's all about the camera for me. my 2 issues is the volume, on phone calls i have to put on speaker phone,just to see if i'm connecting with my caller, i'm still learning how to navigate thru out, also the photos are out of order when transferred over, but pairs well with my car.  pros and cons like everything.",5,2020-01-26 11:02:00
"15","Amazed","I have had the 8 plus in red for 2 years but I was the  lucky One and got a defective device it didn’t happen after the first year was over and I was debating on the 11 or 11 pro and after finally deciding on the 11 I don’t see much of a difference except a little more screen and extra camera but I love my red iPhone 11 best decision and of course Best Buy is the way to go when starting a contract or upgrading they always look for deals and with a lower phone payment",5,2019-12-06 15:35:00
"16","Good Phone","I was impressed by how well the content transferred from my old Iphone to the new one, it even captured my folders on the screen and the open internet windows I had.  I stayed onsite at Best Buy and they helped me get things going.  They also price matched a phone case for me which saved me time and energy ordering it from elsewhere. 

the only struggle I had was transferring my applewatch content to the new phone, my husband had to back it up on a desktop and reset some things before the apple watch would recognize the new phone.",5,2020-01-03 16:15:00
"17","Terrific phone","I’m totally impressed with this new I-phone 11. I was a dedicated Blackberry owner for 20 years! Now I’m wondering what took me so long to switch. At 72 years old I have mastered iOS 13 in a little more than one day! It is so incredibly friendly. I love it.",5,2019-09-27 15:24:00
"18","So many reasons this was a great gift","My son had issues with his old phone and the thought of not being able to get a hold of each other at any time was upsetting to both of us. His old phone likely could have been repaired, but there was no guarantee. It made sense to buy a new phone and know that he not only had something reliable, but also something that had better features and more storage than his previous phone. He loved it and I love knowing that he appreciates the new phone as well.",5,2020-01-18 14:44:00
"19","Impressive New Version of the iPhone","I had been using an iPhone 6s for several years but was having issues with battery life, the charging port, etc. so I decided it was time to update. I debated buying an older model rather than the iPhone 11 to avoid the use of Face ID but decided to go with the most recent model and think that was the right decision. The battery life is fantastic in comparison to my old phone, the picture quality is great and I am enjoying the slightly larger screen. I have still not turned on Face ID but may do so eventually which reduces the ease of use somewhat in comparison to the old thumbprint ID.",4,2020-01-03 16:37:00
"20","Great new phone","I’m still getting used to my new iPhone 11 because it’s quite a bit different from my iPhone 6S Plus. I loved that phone but am starting to love my new iPhone 11 as well. I really like the red color to start with, but also all the new features, such as face recognition, swiping from one screen to the next & the camera takes really clear & pretty photos. There are many other options that I’m still learning, but overall I really like my new phone & would highly recommend it.",5,2020-01-10 16:36:00
"21","Nice upgrade!","I've had an Apple 6+ iPhone for years and finally decided to purchase an upgrade to iPhone 11.  It's a really nice phone and the new features are cool. I wish these phones weren't so expensive but the quality and security this phone provides helps offset the price for me. I also have a MacBook Pro, so I like that I have 2 Apple products that are easy to sync.",5,2020-02-07 16:20:00
"22","Pretty big compared to iPhone 6","I upgraded from an iPhone 6 to this iPhone 11 which is much larger, does not have the ""button"" to push on the screen (now need to swipe right) and does not allow charging and use of headphones at the same time - both use the same port.  Definitely something to get used to.  Some of my App. passwords transferred over, some did not.  I'm still not sure what the difference is in having 2 cameras instead of one.  Learning curve.",5,2020-01-07 17:15:00
"23","Best iPhone ever!","I moved up from an SE. What a difference!  Facial id makes sign on a breeze. You pick up the phone, look at it and boom you are in. Swoop up and there are your apps. Swoop up again to leave an app. 

Sound is good quality. I haven’t used the headphones so I can’t comment. 

This is the 64 gig model. The case is actually as large as the pro.",5,2020-02-01 00:42:00
"24","Real Nice Upgrade!","Upgrading from a 6, this baby really is nice. Battery life is about twice as long, even after taking advantage of battery replacement on my old 6. Processing speed is astounding, app upgrades are super short. Display is large, bright and sharp. Size was more than I wanted, but it still fits in my front pocket. I thought the loss of the home button was going to be problematic, but in a few hours of use I was completely comfortable with swiping up. So much so that I get somewhat lost when I have to use my wife’s 7. The camera is much more capable than I need but I’m finding new uses as I discover features. The only downside is they didn’t give it to me for free!",5,2019-10-18 20:48:00
"25","Switched from Android to IOS","I am new to an Apple IOS phone. There is a slight learning curve for a first time purchaser of an Apple product. I like the phone but, there are a few features I dislike. 1. I don't like that if I am away from my phone and receive a text message or phone call I have no way of knowing I have received either because, there isn't a light that will blink to let me know I have missed either. 2. I don't care for the camera to much. I don't see options to change my pictures such as, low lighting mode, panorama, and others I can't think of right now. 3. I don't like that I can not use some apps that I could on my android. 4. I don't like that I have to turn WiFi off each day from the top right corner pull down. Then it tells me it will turn it off until the next day and each day I have to go through that to turn it off.  If I go into settings and turn it off there, I am not able to use my hot spot. For it to be an Apple 11 (yes I know it's not the pro or pro max) you would think it would have more features. However, as I said I am new to Apple and it could just be that I have not figured things out.",4,2019-11-05 16:05:00
"26","Impressive New Version of the iPhone","Bought this for my wife who had been using an iPhone 6s for several years but was having issues with battery life and fuzzy pictures so I decided it was time to update. I debated buying an older model for her rather than the iPhone 11 to avoid the use of Face ID but decided to go with the most recent model and think that was the right decision. The battery life is fantastic in comparison to her old phone, the picture quality is great and she is enjoying the slightly larger screen. She has been using Face ID but has not been thrilled with the functionality in comparison to the old thumbprint ID. She is also having to replace her phone holders due to the larger size.",4,2020-01-06 15:44:00
"27","Flawless","Lightning fast processor. My emails, reports, PDFs, app updates, everything! downloads so quickly. There is nearly zero wait time for apps that I have had to wait between 30 seconds and 2 minutes for my XR that I traded in.

Camera: the HD features of the 11 are pretty much useless if your subject is farther than 8 feet away. Also, depending on the angle of capture, faces of people can appear slanted or warped if they are on the edge of the shot; I understand this is hard to escape, due to the tiny lens creating a “walleye vision” effect just from the light passing through it. Physics is still unarguable, despite our digital prowess.",5,2019-10-21 08:56:00
"28","So far so good","I went from an Android to an IPhone this time around. I was hoping the battery life would be better but not so much. It is a work in progress getting used to the difference in operating systems. The camera is good not much difference my my old phone. Over all pretty good.",4,2019-09-28 06:36:00
"29","Big upgrade from my wife's SE","All works well. Pro tip, take the plastic screen protector from the factory off before trying to call or you and the person you're talking to will be frustrated. All works well, iOS transfer is great for mirroring devices. Camera was actually less clear than expected. Shots seem very grainy and not high quality when sending to other devices with higher resolution screens.",5,2020-01-03 16:48:00
"30","iPhone 11 is a great phone.","I was cautioned before buying it about it not having a ""home"" button. It took me all of two minutes to get used to using the phone without one.  I like everything about this phone.",5,2020-02-28 18:09:00
"31","Second time was the charm","Got an iPhone 11 on Black Friday and for the first time ever in my Apple buying experience, the phone wouldn't work. It couldn't connect for some reason. After the great help at Best Buy, I was given this phone and it's been great ever since. Getting to know the new functions was pretty easy after having a 7 for so long. 

Great phone for a great cause.",5,2019-12-22 11:10:00
"32","This is a very good phone.","My husband and I both bought one of these iPhone 11 phones. I thought this was a vast improvement over my iPhone 7. It seems to be a very easy to work with phone, now I just have to get used to IOS 13. I wish to commend both Terrell and Adrienne for the great jobs they did for us at the Verizon desk. I think they are a great asset for the Best Buy store in Mishawaka Indiana store.",5,2019-10-01 08:15:00
"33","The sweet spot in the iPhone line up","I, like another reviewer, traded in an iPhone XS Max for the iPhone 11. No regrets! I like the size better, it has a brilliant screen, and saves me $15.00/month on my phone bill. I still have the features of the Pro series that matter to me and paying $400 less for it. All iPhones are great phones and I wouldn’t own anything else but for me the 11 hits all the marks for my needs at a reasonable price. If you’re on the fence about upgrading to the iPhone 11, go for it! You won’t regret it. It’s a great device!",5,2019-10-25 17:49:00
"34","So far , so good.","Present for my son.  His old phone needed a serious upgrafe... so we went for it.  iphone 11.  He loves it! And going to Best Buy instead of going to our carrier... EXCELLENT!  Our Best Buy Rep was knowledgeable & honest... and it only took 20 minutes... seriously only 20 minutes.  We would have been at our carrier for 2 hours.  Ha!",5,2019-12-21 07:38:00
"35","Unlocked and Best Buy is the way to go.","Bought a unlocked iPhone 11 from Best Buy.  The wireless rep was helpful and very quick in helping me add the phone to our account and finding the life proof case I wanted.  This is the 3rd unlocked phone we have purchased through Best Buy.  Highly recommend Best Buy for all your wireless needs.",5,2020-01-04 10:40:00
"36","Great batter life!","This is my first iPhone and I love it so far. The battery life is much better than my google pixel. I do wish iPhones were a little more customizable, however that’s something I will get used to. I also love the night mode camera; it works super well!",5,2019-09-27 18:54:00
"37","Much needed upgrade","The new iPhone 11 net every expectation and more for a holiday gift for my daughter. The sales associates knowledge and understanding of the product made the purchase even more special by explaining FL the functionality of the phone and upgrades over her previous phone. Win Win",5,2020-01-10 16:16:00
"38","So far so good.","I did purchase the XR and the camera was terrible!  I could not understand how a Pixel 2 could be it.  This double camera seems to be a lot better.  I took a video in 4k, but I cannot watch it in 4k on the phone, a little strange, but OK.  Battery life is FANTASTIC.  The screen is bright.  Having a hard time with the sounds, either too loud or cannot hear it. But I like the phone, like IOS 13 and like the dual speakers on the bottom.",5,2019-11-12 09:42:00
"39","I switched to the dark side","I am not a fan of apple.  However all of my kids have iphones and I was missing out on the interconnectivity that iphones have.  I have to admit that this phone has changed my mind about iPhones.  It wasn't as painful of a switch as I thought it would be.  This is a really nice phone and takes great pictures.",5,2019-12-29 00:19:00
"40","Rough start but a great phone","I had some issues, probably from the IOS 13 bugs restoring this phone from a backup. It froze up, shut down and would not power on. After a visit to BB a tech got it back up running using vol up, vol down and power button combo unfroze the phone. After a couple of IOS 13 updates it works fine. Battery life is incredible! All day of sometime heavy use without a mid day boost. Love the wireless charging, but Apple should throw in a wireless charger rather than making us buy one separately. I huge update from my old iPhone 7.",5,2019-10-11 20:38:00
"41","Still getting used to it","This phone replaced an iPhone 5 that was 6 1/2 years old.  I loved that smaller phone, but the battery was just getting weird.  I would lose 80% of my charge in just five minutes.  This phone probably has way more features than I will ever use.  I'm still getting used to swiping it, instead of hitting a home key.  Sadly, it no longer fits into ""pockets"" in my Baggalini purse, so now it's just in the main compartment.  Therefore, I bought a screen protector because I think it's more vulnerable now.  I also wasn't used to the fact that it turns on automatically whenever you touch it.  I was worried I would wear down the charge.  But I do see the benefit of being able to check the time without clicking anything.    The overall huge benefit is that, since I don't use it much, I don't even have to charge it once a day!  I guess it was just time to say goodbye to my trusty 5!  :-(",4,2019-10-24 13:47:00
"42","Holy Camera","The cameras on the new iPhone 11 is fantastic. Battery life is substantially better than the iPhone X and the speed of apps to launch is in milliseconds. Quite impressed with this update and would recommend to anyone considering upgrading.",5,2019-09-27 17:21:00
"43","Excellent upgrade","This was purchased as a gift for someone upgrading from an iPhone SE so the difference in quality was immediately noticed. All of the new features really made a difference in the user experience. The deal I found through Best Buy got us a better price than directly from either Apple or Verizon. Very pleased.",5,2019-12-23 08:23:00
"44","Another great smartphone from Apple!","I replaced my iPhone 6 with this phone.  I'm very pleased with it so far.  I'm glad I have 64GB of storage now-- I used to have 16.

The only thing I've had to get used to is that this phone is larger in size than than the one I used to have.  Other than that, it's been a very smooth transition.",5,2019-12-28 03:51:00
"45","Like bery much.","Haven’t had a chance to use the camera much but I’m sure it will be really good. So nice not running out of memory. Increased from 16 g with my 6S to 128 gwith my 11.",5,2020-02-19 17:10:00
"46","Best value iPhone!","This is hands down the best iPhone you can buy for your money. It has the same cameras (minus the telephoto) and processors as the 11 Pro! Not to mention it has a super long battery life that lasts all day with constant use!",5,2019-10-04 06:58:00
"47","I am really enjoying my upgrade to iPhone 11.","I was surprised to find a better deal from Best Buy than from my provider for my upgrade from iPhone 6 to iPhone 11. I am loving the upgrade! It was an easy transition. No more error messages telling me to manage my storage before I can take a picture or update my apps.",5,2020-01-03 18:30:00
"48","The sound/camera/battery life is great","Sounds like the speaker is in the back, the new surround sound system in this phone is amazing. This camera is no joke and worth buying if your don’t want to buy an actual camera, portrait mode is awesome. You can play music/be online/Play games and you will still have battery by the time you get home. Very impressed with the new iPhone 11",5,2019-09-21 01:31:00
