"","Heading","Text","Rating","Time"
"1954","I love my new phone","I have been an iPhone user for years and this is so much faster and the facial recognition rocks!",5,2018-03-29 13:38:00
"1955","Great update","Actually love it. The full screen is awesome. Kinda glad my phone decided to go on the blink",5,2018-04-19 05:02:00
"1956","Great phone","One of the best iPhones yet! I thought I’d miss the ‘home’ button but I don’t even notice it. Face detection is great. Wireless charging is wonderful. The battery life on this phone is nice & long as well. I’m very pleased that I upgraded.",4,2018-01-21 20:39:00
"1957","Love it","Love the camera, it takes awesome pictures. The battery lasts 2 days!!",5,2018-07-13 12:32:00
"1958","Love it","Bigger screen is a great thing!! Excellent camera quality great product once again apple",5,2018-05-04 23:07:00
"1959","iPhone X - A sign of the times","Good phone. Hard adjusting to life without the button. Faster than my iPhone 7.",4,2018-08-17 16:23:00
"1960","Great Phone","Just a day in and I love the new phone. I am pleased with how easy Face ID works and have not experienced any issues with it thus far. I also think it is a tad quicker than the fingerprint from before. It feels very solid and the display is flat out amazing",4,2017-11-24 15:08:00
"1961","Best thing going","Man I love my iPhone X. The features on this phone are amazing",5,2018-08-10 16:24:00
"1962","I love my new x iPhone","Work great , learn a lot new stuff. The pic quality there good , battery it’s better",5,2018-05-19 10:28:00
"1963","Love my phone","Love how fast and how clear the camera is. Definitely a keeper",5,2018-08-10 08:10:00
"1964","IPhone X","So far the phone is working great. I like the facial recognition feature.",5,2018-06-30 18:51:00
"1965","Great phone","Purchased for my son. He LOVES it. Always used iphone",5,2018-09-10 08:14:00
"1966","Great phone","The new iPhone X has a fantastic camera and great new features. The full screen is easier to read and work on.",5,2018-01-27 18:46:00
"1967","Good","I like the phone it works really well when I have good service",5,2018-08-08 18:18:00
"1968","Good phone","My daughter love it, excellent for her business, Good deal Best Buy.",4,2019-03-20 19:43:00
"1969","good place to get phones","great phone , love e camera also the emojo are great",5,2018-09-12 16:51:00
"1970","Great smartphone","The Iphone X is a great phone. I love it. It is very easy to use and love the new features.",5,2018-04-18 18:20:00
"1971","Best iPhone yet !!","I’ve owned android and iPhones.
This phone by far is the best. Ease of use is top notch !!",5,2018-04-18 17:53:00
"1972","good weight and fits perfect in hand","much better video overall. using Dexcom G6 app on it works perfectly.",5,2018-07-13 16:19:00
"1973","iPhone X","Took me a few days to get used to no home button but after that I wouldn't have any other phone !",5,2018-03-24 14:03:00
"1974","IPHONE X","Nice looking phone, took some time getting used to all the features it offers. A tad bit on the expensive side though.",5,2017-12-20 23:45:00
"1975","Great phone","This iphone is a very nice phone for you and your entire family to use.",5,2018-07-05 13:32:00
"1976","Great Phone","This OLED screen is amazing, the speed of this phone is great, responsive, and the gestures are easy to adapt too. Love it.",5,2017-11-26 15:40:00
"1977","Wife Loves her new phone","Bought the phone for my wife for her birthday and she loves it.",5,2018-08-03 19:01:00
"1978","Great photos","Wonderful phone. The face recognition is a plus! Super fast.",5,2018-08-14 12:21:00
"1979","Great phone, long battery life","Excellent camera and battery life. Perfect size for pocket.",5,2018-08-17 17:50:00
"1980","Great","Glad i bought it now they are not making it anymore",5,2018-09-14 16:16:00
"1981","Good phone, great camera","Phone is good but the camera is great. Battery life worse then expected. Pricey for what you get. So, unless you need a phone with the best camera, stick with the 8.",4,2018-08-11 14:10:00
"1982","The best IPhone","So far this is the best IPhone I ever had. It is fast and the battery last me at least 2 day before It needs to be charged!",5,2017-11-24 15:32:00
"1983","The BEST so far","So far it works like advertised and I have not had any problems.
The battery seems to last much better than my 6s",5,2018-01-05 16:33:00
"1984","IphoneX","Upgraded for my daughter and she loves it."" IphoneX "" rocks per her words.",5,2018-06-22 12:45:00
"1985","Well-Made Product","This is a duplicate review; this was a gift to another individual.",5,2018-07-22 11:42:00
"1986","Best phone","Best invention of 2017. The usability and ergonomics of iPhone X are extremely great. This is simply best phone you can buy.",5,2017-11-19 06:37:00
"1987","Love my iPhone X","I purchased the iPhone X to replace my iPhone 6. I absolutely love my new phone - great camera and easy to use!",5,2018-01-18 09:51:00
"1988","Best iPhone Ever","I went from a 6 to the X, I really enjoy the capabilities it gives, and the battery life has improved immensely!",5,2018-01-13 07:15:00
"1989","Iphone X","The best smart phone on the market there is. Love how all my data was transfered in a hearbeat!
Just love it!!",5,2018-01-17 19:45:00
"1990","Awesome phone","I’ve upgraded from a 6 to the X and the differences are crazy. Best iPhone yet!",5,2018-06-01 20:32:00
"1991","Great phone","Love the size of screen. Takes amazing pictures (love portrait mode)",5,2018-07-13 20:25:00
"1992","Good iPhone X","This phone is nice, fast, clean and clear then the others were ! Easy to use and with lots of features in it ! Good one !",5,2017-12-01 12:52:00
"1993","Awesome Phone!","Love the phone! should have traded in my old iPhone a long time ago.",5,2018-07-13 12:53:00
"1994","Great Phone","Excellent phone, but costs too much! Camera is unbelievable",5,2018-08-14 18:36:00
"1995","Love it","Love it. It has face recognition and the battery lasts longer.",5,2018-08-03 21:24:00
"1996","Excellent phone","Had Samsung galaxy 5 prior to iPhone X. Good reception, camera, mail and texts work well.",5,2018-04-20 18:45:00
"1997","Love this iPhone","Best iPhone I’ve purchased in a while, the camera is amazing",5,2018-08-10 12:28:00
"1998","Extremely easy to use","Had the IPhone 8 and it was a bit bulky, the new X is very light weight and sleek.",5,2018-05-18 21:52:00
"1999","Still learning","Switching from a 6 to a X is a new experience after years. It works great - still learning how to use everything.",4,2018-12-11 09:09:00
"2000","Great Cell","Got this cell phone for our daughter who loves it for school purposes!",5,2018-07-03 20:36:00
"2001","new phone has a learning process but great","great photos color is wonderful. It took a while to discover all of the new and old functions of the apple and new x phones",5,2017-11-18 10:11:00
"2002","iPhone X!","My wife upgraded her iPhone 6 Plus and never looked back. iPhone X is perhaps the most advanced smartphone there is.",5,2017-12-21 10:13:00
"2003","Awesome","I love this phone also best buy guys are awesome and really useful when it comes to answering questions about this phone",5,2017-12-01 16:55:00
"2004","Surprise Xmas Gift","I bought this for myself and I love it and the improvemed camera so I bought another one as an Xmas gift for my wife",5,2017-12-20 17:00:00
"2005","I like the facial recognition","I bought this phone because of the security measures it incorporates.",5,2018-07-06 16:27:00
"2006","Great phone","I upgraded from a Iphone 7 Plus to this Iphone X and it's been great.",5,2018-07-06 16:25:00
"2007","No Regrets !!! Love my phone","This phone is awesome, design, performance, battery life, sounds, you name it. 
Best phone I've owned hands down!",5,2017-12-29 17:55:00
"2008","Awesome phone!!","My Apple iPhone X is one of the best phones I’ve owned!! Great pictures!!",5,2018-06-21 08:02:00
"2009","Not for the beginner","After being an Andriod user for several years I returned to iPhone X. Yes, Apple Yes!",5,2018-05-04 20:39:00
"2010","Love the X","This is replacing my aging 6 Plus. So happy. Only disappointment is it costs as much as a laptop!!!... but, I use my phone more than my laptop.",4,2018-09-30 19:43:00
"2011","New iPhone X","My son upgraded from iPhone 7 and loves his new iPhone X. He's very happy with it.",5,2018-05-16 17:53:00
"2012","Great phone","Great device. Took some time to adjust to Face ID, but it’s an easy adjustment and works like a dream.",5,2018-02-21 16:43:00
"2013","Love it","It takes a little to get used to. But other than that... I love it!",5,2018-07-13 18:07:00
"2014","Love the Face ID feature","Love everything about this phone. And the camera quality is great",5,2018-07-20 14:48:00
"2015","phone","I guess it is a great phone I bought it for my daughter",5,2018-08-25 12:13:00
"2016","Love the phone","At first it’s difficult without a home button but you get use to it and everything else easily!",5,2018-03-21 22:14:00
"2017","Service was amazing","This phone is top notch and service was fast and fantastic. They sure know their iPhones too!!!",5,2018-03-21 18:03:00
"2018","great phone","The iphone x works great..super fast and looks amazing.",5,2018-08-24 16:48:00
"2019","In love with iPhone X","The X is everything I asked for in a phone! It’s easy to use and all my info transferred over without any problems!",5,2017-12-21 08:45:00
"2020","Love this phone!!","Best phone I’ve ever had. A little bit of a learning curve for this g-ma though",4,2019-02-20 16:54:00
"2021","Is really fast and responsive","The iPhone x is really fast and it recognizes my face almost instantly and I hope that you enjoy this product to.",5,2017-12-30 12:27:00
"2022","Awesome phone","Can’t complain I love my upgrade, the camera is just wonderful !",5,2018-07-22 14:15:00
"2023","Love the iPhone X","Really love my new iPhone X. The camera takes great pictures and the Face ID is awesome.",5,2018-04-19 11:10:00
"2024","Awesome phone","My son got the phone for Christmas absolutely loves everything about it. Great camera very sleek and a beauty",5,2018-01-17 21:11:00
"2025","I really like it","This is a great iPhone. I really like how it works, and you will adapt quickly using an iPhone with out home button.",5,2017-12-15 17:09:00
"2026","Excellent Camera","Love the face regonition detail works spot on .
Has an amazing Camera just an all round excellent phone.",5,2018-02-04 09:58:00
"2027","Works","I didn’t really want to upgrade my phone when I did but I had no choice when my old phone died. I looked into a couple of other brands but felt at this point I had to many other Apple products to make a switch. I wish Apple would try to compete with other manufacturers and their products. Put some work into the camera and other features I with actually use as a grown person vs the emoji bs. I mean come on great for middle schoolers. It has been a bit annoying learning all the new gestures but that will go away with time.",3,2018-06-29 18:46:00
"2028","newest!!","my son loves the phone with it's upgrades from his 7!",5,2018-08-30 19:50:00
"2029","love the face recognition","I was hoping that the 10 had a 10 plus but the size is good.",5,2018-08-05 11:06:00
"2030","Great camera and larger view area","This is a great phone with a long life battery.
Pictures are great.",5,2018-07-06 12:33:00
"2031","Great phone","Love all the new and exciting features. Best phone I have ever had",5,2018-07-13 13:25:00
"2032","Great iPhone","I love my new iPhone X, great camera for take a pictures every where to my kids.",5,2018-05-19 19:10:00
"2033","Loving the X","So far, it's been impressive. I'd recommend it to iPhone lovers!",5,2018-07-20 15:10:00
"2034","Nice Phone","Takes a little while to get used not having a button, but has a nice full screen display. Wireless charging a plus.",5,2017-12-17 23:08:00
"2035","Next Gen Phone","Wasn’t sure I was going to like the no home button feature, but got used to it really quickly.",5,2018-03-21 22:58:00
"2036","Best phone","Everything about the phone is easy to use and the new features that it comes with are amazing.",5,2018-03-21 20:00:00
"2037","Excellent phone","This phone is quick, and works really nice. I give this 9/10",5,2018-08-03 14:44:00
"2038","Great Phone but needs finger print scanner","Very good phone but needs a finger print scanner, I feel the need for it while using apple pay and when the phone is lying flat. Hence the 4 stars or else its a good phone.",4,2018-07-13 12:43:00
"2039","excellent employees","very nice people, they are there to help you. I am happy",5,2018-08-17 18:56:00
"2040","A tradition of excellence continues.","I am a loyal iPhone user. X is the best yet. I’m still getting familiar with it, but I’m extremely happy with my device.",5,2017-11-22 02:13:00
"2041","iPhone","I really like my phone. I am loving it. Except if it is dark sometimes the phone doesn’t recognize my face.",4,2018-12-19 17:37:00
"2042","Great phone","Super fast phone , so far the best iPhone I ever own . Pictures quality is beyond good and the from camera is awesome.",5,2017-12-01 14:39:00
"2043","Great phone","Great phone and camera plus the other features that are extra oridinary",5,2018-06-22 13:06:00
"2044","Love It","I love it! Its is a perfect size, not as big as i thought, screen resolution is nice and i can do everything on it.",5,2017-12-15 14:18:00
"2045","Love it!","I love this phone! The camera takes such great pictures. The video quality is great as well. Best iPhone to date!",5,2017-12-23 13:26:00
"2046","iPhone X","This is a great phone very easy but at Best Buy movil",5,2018-08-27 02:43:00
"2047","Awesome phone","Love this phone- great camera and features. Battery life is really good",5,2018-06-20 17:29:00
"2048","Very nice phone","Coming from an iPhone 7 Plus, I wasn't expecting to be blown away. Turns out, I was still wowed by this phone.",5,2018-01-05 15:46:00
"2049","Decent phone with nice camera","The camera is a huge improvement over my iPhone 6. It is much quicker with processing. I do not see it was a awe inspiring phone for the $$.",4,2018-10-01 10:28:00
"2050","Great phone","Love the new options and always love i phones. Cant wait for the new one!!",5,2018-06-08 13:06:00
"2051","Awesome phone","Love the iPhone X. It was hard not having the home button at first but don’t mind at all now.",5,2018-03-22 09:06:00
"2052","Love this phone","My son loves this phone. Had to have it. Camera very clear takes nice pictures.",5,2018-05-18 17:23:00
"2053","Great phone","I bought the iPhone X about 3 weeks ago and I love it. Face ID is amazing and I love how easy Apple pay is to use",5,2017-12-20 19:09:00
"2054","Fantastic Phone","I highly recommend the iPhone X. It is one of the easiest phones to use and produces most spectacular photographs.",5,2017-12-15 19:12:00
"2055","Great Phone","Great Phone Features work well. Good Quality camera",5,2018-09-01 10:57:00
"2056","New iPhone","Love my iPhone X! Amazing pictures and quality of phone is amazing!!!",5,2018-06-26 14:48:00
"2057","Love it","Love my upgrade. I was a little hesitant at first but it’s easy to use",5,2018-06-22 13:43:00
"2058","Pretty neat look","Love the glass look... not too small not too big either, perfect fit for my pocket",5,2018-05-05 14:18:00
"2059","Emojis!!!","Wife loves this phone. Facial recognition is great and the speed is incredible. Apple fan for life!",5,2018-02-21 16:59:00
"2060","Great Phone","This is a great phone, apple never disappoints me.",5,2018-09-03 21:39:00
"2061","Very sleek","Sleek and sophisticated looking phone. I love the whole glass design.",5,2018-06-25 06:29:00
"2062","Great phone. Like all the new features.","A little expensive but what else can you do if you want the latest technology.",5,2018-05-20 11:33:00
"2063","Great phone","I personally think it’s better then the other iPhone ! I love it",5,2018-07-13 14:07:00
"2064","Great phone overall","This is an amazing phone and anyone that wants it should get it!",5,2018-07-13 13:24:00
"2065","AAA+++","Best phone I never had. Easy to set up and use. would buy again.",5,2018-07-13 12:37:00
"2066","Fantastic","New iPhone screen is beautiful, camera is very clear and gesture are very natural. Huge upgrade from any prior iPhone.",5,2017-11-22 13:35:00
"2067","Best phone ever","Does everything I want and more, worth the price!!",5,2018-09-02 19:16:00
"2068","iPhone X","I absolutely LOVE it. It’s so much nicer than the home button. What a joy this phone is.",5,2018-04-08 08:01:00
"2069","New looks good","Still figuring it out. Expensive. Lots of features. Expensive to repair, apparently, so buy a good, protective case.",5,2017-12-01 12:51:00
"2070","New Phone Rocks!","I bought this to relace my daughters old Iphone 6 she loves it.",5,2018-07-16 14:59:00
"2071","Best till date","Best till date. I bought apple care for my iphone x",5,2018-08-29 16:59:00
"2072","Amazing","Love It Thank u guys So much You Rock i Love new Phone",5,2018-08-18 17:16:00
"2073","iphone x 256gb","its a good phone jsut dont know if is worth that much money but when your wife ask for it what can you do lol",5,2018-01-03 12:10:00
"2074","Excellent iPhone","Happy I upgraded to a newer model of iPhone. Love the features",5,2018-07-19 21:05:00
"2075","The best phone ever","Finally Apple made a great phone! Love screen, all features, Face ID!",5,2018-06-22 20:30:00
"2076","Great quality","Great phone ive had iphone before this is really good but is pricey",5,2018-06-30 12:33:00
"2077","Great","This is a good looking phone and works very well. About to go get 2 more for my sisters.",5,2018-04-06 12:17:00
"2078","Amazing","Loving my absolutely amazing wonderful phone. Is awesome",5,2018-08-10 13:17:00
"2079","Best iPhone ever.","I have had every iPhone they have made since the very first one and this one is by far the best one ever.",5,2018-01-20 16:55:00
"2080","Nice screen","This is the nicest screen I ha e ever seen on a phone.",5,2018-08-17 16:53:00
"2081","Easy use. All data transferred ez.","Very nice to hold,easy to use, great clarity and great screen size.",5,2018-06-30 00:57:00
"2082","Amazing camera on this gone","I used sales normally but this phones Camer is so good I’m ok leaving my camera at home for quick snapshots.",5,2018-01-05 22:35:00
"2083","Best iPhone so far","Top features. Great camera and photos it produces. Now with wireless charging.",5,2018-05-16 19:58:00
"2084","Good Phone","It’s a good phone for anyone looking for the jump to the next fen",5,2018-07-06 12:45:00
"2085","Very advanced device","Menus are very handy, organized and easy to find and pull",5,2018-08-05 10:18:00
"2086","iPhone","Great phone!!! Love the face recognition. Would recommend to a friend",5,2018-06-20 18:28:00
"2087","Very good","I like the product. It is very good and I definitely recommend.",5,2018-07-13 20:28:00
"2088","Longing for the Home Button","The camera is phenomenal. The facial recognition works well in even in low light. I haven’t broke down and added the faux home button but I sure miss it! I find closing apps to be particularly difficult.",4,2018-04-06 21:02:00
"2089","Super Phone","Best iPhone yet! Love the faceid and the phone is super fast. Very responsive. The screen quality is amazing.",5,2017-12-30 17:48:00
"2090","Amazing Phone","Great screen. Very fast and responsive. Love the face id unlock. No button on the screen was very easy to get used to.",5,2017-11-16 19:46:00
"2091","Awesome Phone","I love the iPhone X! My favorite feature is the camera, the pictures are incredible!",5,2018-04-20 15:07:00
"2092","iPhone For Life!","I just purchased an iphone x and I love it! It definitely takes some getting used to but you will not be disappointed.",5,2017-11-16 13:11:00
"2093","It’s an Apple product","It’s an great apple product dose what it is programmed to do.",5,2018-07-20 13:13:00
"2094","Memoji on the loose!!!","Bought this for my daughter and she loves it. She quickly adjusted to the missing home button and loves making Memojis",4,2018-11-16 19:33:00
"2095","Great","Wonderful phone , wide screen , loud speakers ....",5,2018-08-29 17:10:00
"2096","Love the camera features","Loving my new iPhone X. The photo features especially portrait mode are wonderful. I still think it’s overpriced but I’m happy with it overall. Didn’t think I would like the Face ID buts it’s actually a great feature.",4,2018-02-21 17:51:00
"2097","Love","Great product, wasn’t hard getting used to not having a home button. Love it",5,2018-05-22 13:33:00
"2098","Love!!!","Absolutely LOVE my phone and the service I get when spending a lot of money at Best Buy!",5,2018-04-02 13:26:00
"2099","Love it!","Phone is great and I love the look and feel! Much faster too!",5,2018-07-19 19:00:00
"2100","Wow!","So, I went from the 6S to the X..wow! Physically, it isn't much larger, but the larger visual area is great! The face recognition is OK...Doesn't always recognize me, but I understand it improves over time. (I only have it 24 hours!) In this time, I've moved on from the home button and don't miss it. It is faster, clearer, Siri has an immediate answer. I'm very happy!
I ordered this phone online to pick up in store. It comes without a SIM card. I was told to use the one from my old iPhone. That didn't work. I went back to Best Buy. They were very helpful. After four different SIM cards, it was working!",5,2018-11-18 22:37:00
"2101","Awesome phone","It’s cifferent than the iPhone you’re used to but once you get the hang of it, it’s a great phone",5,2018-02-21 17:51:00
"2102","iPhone X","I love it. So many cool features really fast big screen",5,2018-08-10 12:52:00
"2103","iPhone X Rocks","The iPhone X is incredible. Best one I’ve had by far.",5,2018-08-17 14:28:00
"2104","Iphone X","I got this for my son for his birthday! He loves the phone and all the features.",5,2018-05-04 17:36:00
"2105","Nice phone","Don’t get me wrong I like the plus phone but this phone tops it.",5,2018-07-07 07:31:00
"2106","Very good item","This is the best thing that I bought from Best Buy.",5,2018-08-24 16:51:00
"2107","Great","Apple has once again delivered. Very happy with this purchase.",5,2018-07-14 21:40:00
"2108","AWESOME PHONE","Love this upgrade to my previous 6. the x is awesome and fast.",5,2018-07-14 19:34:00
"2109","Time for an upgrade","Got this for my brother. He loves his IPhone and all the apps.",5,2018-07-14 18:25:00
"2110","Great phone","I love this phone but it would be perfect if it had an rca jack. Not sure why they are being stubborn about it. They know customers want it back. I also miss the home button fingerprint reader. Great phone though.",4,2018-03-03 22:45:00
"2111","Finally","An iPhone that is different from all the rest. Been with droid since 2008 and the transition wasn’t so painful.",5,2017-12-16 09:00:00
"2112","iPhone X","I love the new phone!!! I got the 256 because I will be downloading a lot of music",5,2018-04-25 11:29:00
"2113","iPhone X","The IPhone X was the best purchase I made the phone is amazing",5,2018-07-13 20:02:00
"2114","Great Phone","Great Phone and excellent camera. Would recommend this phone",5,2018-07-21 08:33:00
"2115","Bought iphone with peace of mind","Best way to by electronics is through best buy. They take good care and will help you out.",5,2018-03-21 18:23:00
"2116","Beautiful device","I thought I would struggle without the home button but I got use to it within 2 minutes. Love this phone.",5,2018-01-12 17:25:00
"2117","Love the features","Best iPhone yet I love it my kids love it every one loves it",5,2018-07-20 16:48:00
"2118","Awesome","Great phone. Could not ask for anything better....",5,2018-08-26 07:37:00
"2119","Love the Phone","I love Apple iPhones and once again they don't disappoint!",5,2018-07-27 17:08:00
"2120","Best iphone","Love the face recognition feature. Very easy to use.",5,2018-08-18 17:31:00
"2121","Great","Works great and fast phone apple is the best never doubt",5,2018-08-03 13:01:00
"2122","Same look as 6s","Good picture quality . Lots of storage. Face ID is new",5,2018-08-10 13:18:00
"2123","Love it","I love this phone . It’s a great fit in the hand and so easy to use . Love all of the new features it comes with",5,2017-12-06 23:28:00
"2124","Best phone I own","This phone works very well with my hearing aids. The Android phones did not.",5,2018-05-16 17:35:00
"2125","Great","Great!!!!!!!!!!!!!!!!!!!!!!!!!!!!!!!!!!!!!!!!!!!!!",5,2018-08-24 17:41:00
"2126","This is a awesome cell phone","The facial recognition Works great I have not had any problems with my iPhone X yet. I enjoy it thoroughly",5,2018-01-04 08:32:00
"2127","Ipone x","Great phone, will definitely recommend............",5,2018-08-24 16:07:00
"2128","iPhone X","Nice and light however same size screen as 7 plus.",5,2018-08-24 12:35:00
"2129","I’m in love","Loving my new iPhone. The camera is amazing and the face recognition works perfectly. I couldn’t ask for more.",5,2017-12-15 17:56:00
"2130","Excellent phone","Great phone quality. Overpriced in many ways but it’s an iPhone",5,2018-07-06 16:56:00
"2131","Best iPhone yet","I love all the memory I have now and the phone is the best.",5,2018-07-21 13:02:00
"2132","In love","So in love with my phone wouldn’t change it for anything else completely satisfied",5,2018-04-19 22:07:00
"2133","Very fast and intuitive","Great phone with a really nice camera and audio. Very easy to use and really sleek and comfortable. Battery life needs improvement though.",4,2018-09-23 07:41:00
"2134","Iphone X rocks!","Love the features and all that comes with this phone.",5,2018-08-11 13:27:00
"2135","Best iPhone yet","Finally a totally new design on the iPhone X and I have to say I’m a fan. This iPhone looks and feels amazing!",5,2017-12-12 14:29:00
"2136","Easy to use iphone","I love my iPhone. No problems at all. It takes great photos",5,2018-07-19 19:08:00
