"","Heading","Text","Rating","Time"
"467","Latest tech from Apple","The phone feels more solid in the hand and futuristic with the new Face ID. Combined with the image stabilizers for the cameras and the new faster processors deliver the best iPhone experience yet.",5,2017-12-03 07:39:00
"468","Awesome phone","This phone takes a little getting used to but is awesome. Not having the home button makes for less chances of the button breaking like it did on my last iPhone. Taking photos is a snap and they come out picture perfect.",5,2018-08-13 17:26:00
"469","great product","Great product, would purchase again without hesitation",5,2019-06-18 09:31:00
"470","Best phone yet","Great amount of memory and easy to use! Love Apple products",5,2019-06-10 07:51:00
"471","Next gen stuff!!","I have been an iPhone user since 3G to include all the Plus iPhones, yes I had the 8 Plus. All I can say is this phone is incredible! The screen, speed, responsiveness and of course the Face ID is slick. I do have to say, I miss the battery life of the 8 Plus. Nonetheless, I am very happy with the X. Highly recommend!",5,2017-12-15 17:29:00
"472","Iphonex for Everyone","Nice item from what I can tell. Not for me but my granddaughter and she loves it. She is 11 and is on it right now and pretty much sun up to sundown....",5,2018-12-28 14:06:00
"473","iPhone X","Just as promised - amazing visuals and the X is easy to use. It only takes a short while to get used to not having a HOME button. After owning 3 other iPhones- this one provides the best battery life.",5,2017-11-17 12:25:00
"474","I love this phone","This phone has been easy to use.It was a very quick process learning to function without the home button. Camera is nice and that was very important to me.",5,2018-12-22 08:07:00
"475","Good phone","I’ve had the phone for about a year now, it’s solid. I get many compliment on the video quality when showing a video I took.",5,2019-02-17 13:04:00
"476","Great phone","Excellent phone...easy to use. Great quality camera",5,2019-06-21 15:49:00
"477","Iphone X","Great purchase, would recommend the X over the XS or XR",5,2019-06-14 13:11:00
"478","Great phone","Great phone! Love that there’s more screen and the home button was removed. I like the camera software especially with a little kid it takes great pictures",5,2018-12-19 20:12:00
"479","Excellent phone","I upgraded from an iPhone 7 Plus. I love the smaller size of the phone itself without sacrificing almost any screen view. I’m very happy with the iPhone X.",5,2018-12-19 17:14:00
"480","Love","Best camera on a phone. Ever. Caution on the screen, it is the same OLED as the Samsung Galaxy and I would HIGHLY recommend getting the Apple care. It’s $7 a month, and I promise it would be over $300 to get that screen fixed, and that’s if you could find someone who knew what they were do it. Just a thought.",5,2018-01-01 12:09:00
"481","Great phone","Upgraded and loved every aspect of this phone. Would recommend to anyone?",5,2019-05-15 17:24:00
"482","Apple is number one","Apple is great for cell phones . I enjoy the features and camera . Takes great pictures. Is fun for social media apps too",5,2019-02-20 19:29:00
"483","Great phone. Easy transition from iPhone7","Great phone. Can definitely see improvements in camera over the 7 also bigger screen. Also was a great deal financially.",5,2019-02-22 14:20:00
"484","Amazing pictures","If you can stomach the cost, the X is amazing for taking pics. The screen is so big now that it doesn't have the home button and such so it's great for watching video but the camera is the real deal. stunning.",5,2018-08-28 14:49:00
"485","Love the phone","The phone was tweaking when I first bought it but it just needed to be updated after it was turned on. Works great besides the first tweaks",5,2019-01-16 18:20:00
"486","Best iPhone ever","Great phone , fast speeds , great quality camera , stylish",5,2019-06-07 16:38:00
"487","Another iPhone","Upgraded to the X from an 8plus. Other than the facial recognition, from the thumbprint there really much noticeable change. It’s a good phone though, I just wouldn’t recommend spending the money unless your in need of an upgrade",4,2019-03-18 20:06:00
"488","Best Iphone Ever!!","I love all the new features on the iPhone X especially the new Face ID. I no longer have to take off my gloves to type in passwords. The camera is amazing even in lower light. It has a great feel too with glass being on the front and back. I would definitely recommend upgrading from older iPhone.",5,2018-01-28 14:42:00
"489","Great iPhone","As with other iPhones this one does not disappoint. Love the facial recognition feature.",5,2018-11-03 09:28:00
"490","Great iPhone","This is one of the best iPhones I have ever owned.",5,2019-06-20 06:40:00
"491","Best phone","I've only owned iPhones and this is probably my best phone yet",5,2019-05-31 12:58:00
"492","Love my new iPhone!","Upgraded from the iPhone 7 and am so happy I did. The camera on the X is phenomenal and the screen is so clear and crisp. No lag time at all opening apps. I'm sure it does so much more than I know right now but so far so good!",5,2018-07-19 10:49:00
"493","Love it!","I am so in love with my phone. It took me a while to get the hang of it but it works now. The only thing I miss is that I can’t see my batter percentages anymore unless I view my control center. Other than that the features are great and the camera is amazing!",5,2018-04-30 01:49:00
"494","Awesome Phone","Thus phone is amazing. It is super fast & the Face ID is so convenient.",5,2019-05-15 21:08:00
"495","Amazingly brilliant phone!","Amazingly brilliant phone!
I have vision problems so with the display adjustments on this device I can feel confident using this iPhone!",5,2019-01-17 23:41:00
"496","Good","This is still a great pickup and now it’s cheaper than the slightly newish gen",5,2019-05-03 20:29:00
"497","Great phone in 2019","This is still a great pickup and now it’s cheaper than the slightly newish gen",5,2019-05-03 20:28:00
"498","Great phone","I'm very happy with my iPhone X. It takes some getting used to if you've had the older version, but you can ask Siri how to do things which is very helpful. The battery is quite good and the display is excellent.",5,2018-08-17 12:25:00
"499","Great phone","The facial recognition is extreme fast. It takes a little getting used to not having a home button after having had an iPhone 6 Plus for the past couple years. Easy to use I really like the IOS features and look forward to seeing what Apple plans to enhance the augmented reality capabilities.",5,2018-02-03 08:40:00
"500","Very quick and easy to learn","I am very happy with the iphone 10 although i am upset they come out with another phone soon after, but those are the breaks. Its expensive however its very easy to use.",5,2018-11-15 15:33:00
"501","Executive previledge","Man must have and still on top of the line in terms of the phone world. Especially with the corresponding accessories.",5,2019-02-20 18:24:00
"502","This Phone Works Great!","The iPhone is easy to use and almost never has any software issues. I have never had any hardware issues & I drop it more than anyone should. Battery life is great. I use it for work all the time.",4,2019-04-24 16:51:00
"503","Great phone","this phone is awesome, the major drawback is that some of the facial features seem to not work as the power gets lower. High quality apple product as always.",5,2018-12-06 11:35:00
"504","Camera features are great.","Always love iPhones, this one has impressed me. Dual camera, face recognition are just a few of the features I enjoy.",5,2019-02-20 17:57:00
"505","The phone that all others try to be.","The best phone out there, hands down. Not having a home button was only strange for a day or two, then I didn’t even notice it anymore. I really can’t say anything bad about this phone. Just make sure you get a solid case!",5,2018-07-20 17:01:00
"506","I LOVE IT","I had the iPhone 6 before I got the X I had to get used to the new features. Now that I am used to unlocking it with the facial recognition it's great!",5,2018-04-18 21:53:00
"507","Apple!","Another great apple iPhone from a fantastic company",5,2019-06-14 17:34:00
"508","Greatest iPhone thus far","I bought this for an older family member, and she loves it. She likes that she can just swipe rather than push a button. She had a difficult time with the button and now she just swipes any way she needs.",5,2018-08-27 19:50:00
"509","Great Phone","Love this phone!! Dont know if ill ever switch to another brand.",5,2019-05-23 13:35:00
"510","Apple did it again !!","Good phone but I got it for the available 256 GB. I have 16,237 songs, a few movies, and shows. Not letting me down.",5,2019-02-20 17:31:00
"511","Best phone ever","The screen is amazing the color and picture is crisp. It is beautifully designed, I could just look at it for hours. The camera is pretty good I really like the portrait mode and zoom features. The Face ID ended up being one of my favorite features, it makes it so easy to unlock cause I always have gloves on at work",5,2017-11-17 16:14:00
"512","iPhone X","I have had it for a couple of weeks now after switching from an IPhone 7 Plus. There isn’t a lot of change from the 7 with the exception of the closing of the apps and Face ID. I prefer the closing process of the 7 over the X. The Face ID is ok as long as you aren’t wearing sunglasses. Sometimes it will work with the glasses on and sometimes it won’t. I’m hopeful that they come out with a larger sized X since this one is a little smaller than I care for.",4,2018-04-28 11:00:00
"513","Awesome","It’s a good photo easy to use the speed is very fast I would recommend it to everyone it’s not to big for your pocket",5,2019-02-16 13:53:00
"514","Love my phone","I’m in love with my iPhone X the camera quality is amazing",5,2019-05-31 16:21:00
"515","Great product","I am an Apple fan and couldn’t wait to get the newest phone. I does not disappoint.",5,2019-04-18 19:23:00
"516","Great phone","This phone does everything I wanted and a lot more. I'm finding it extremely easy to use. I've had no problems with it. I've had if for a little over a month now. Very pleased with it. I've only had a couple of low end tracphones before this one.",5,2018-05-17 05:38:00
"517","Great phone","When looking to upgrade my phone I was wondering if it was worth it going from eight to a 10x. Now that I have it I love the way it works. It’s a lot faster and with the expanded memory it’s even better.",5,2018-08-24 13:12:00
"518","Amazing Phone and Service from Best Buy","I had a great experience with Sprint rep at store, this phone fits all my needs from photos, videos, and connectivity with all other apple products while one the most updated OS.",5,2018-10-17 14:58:00
"519","Great phone.","Apple never disappoints. Great phone ... takes a minute to un-learn your home button tendency but you will be surprised how fast you adapt.",5,2019-01-04 14:29:00
"520","Such a great phone","I’ve had this phone for almost a year and it’s been the best phone I’ve ever had. Apple always makes good products but they went above and beyond on this one",5,2018-11-28 16:41:00
"521","Great Phone","Just upgrade my phone and I loved this phone. Face ID works!!! It's really fast.",5,2018-11-10 06:24:00
"522","Great Upgrade","I really like this phone! Upgraded from iPhone 6 and I missed the Home button for about an hour, but not anymore. It just takes a little time to get used to swiping up and then you forget you ever had a button. Face ID is great and even works in low light conditions.",5,2018-03-21 21:43:00
"523","Love the new design","It took a couple of days to get use to the fact that the home button was gone but I feel it is a great change. Pictures are amazing.",5,2019-01-16 18:04:00
"524","Very Nice","The phone works well. The sound quality for listening to music and using speaker phone is very good. Once you get the hang of some of the different ways the phone works( which are easily googled ) its very user friendly . The face recognition is slightly annoying at times but generally is reliable. Other than than no issues",4,2018-01-26 13:09:00
"525","iphonex","love the new apple iphone - it's everything that it was promised to be. Great pics and definitely water resistant",5,2019-02-21 10:16:00
"526","excellent speed and camera","very fast processing, excellent pictures and screen, deceivingly large screen. I went from a 7 to the X, it is a bit larger and harder to handle with one hand, but the trade offs for the quality of phone are worth it.",5,2018-07-20 09:25:00
"527","Apple phonetic","Got two of these for my teenagers and now I am the Best Mom in the world.
They love them. I do suggest getting good cases and screen protectors because of the all glass body. This is a pretty pricey electronic so replacing would be just as much as buying a new one.",5,2018-03-21 22:45:00
"528","Awesome","Very fast processing, no lag, picture quality is amazing, overall best iPhone yet.",5,2019-04-17 19:24:00
"529","No denying this is an amazing phone","The notch, does it bother me? Absolutely not. The information (battery level, time, etc.) kept in the corners needs to be displayed, and by putting it up out of the way by the notch, Apple just gave you more screen real estate to work with... a screen which is amazing without the bulk of a larger phone.",5,2017-12-08 13:30:00
"530","Worth It","The iPhone X is worth it. Both my brothers have it. I did a lot of research to find out if it was worth the extra money. I upgraded from the iPhone 6s. In the back of my mind I was thinking about trying it out for a day or two then taking it back. I will not be taking it back this phone is awesome.",5,2017-12-21 06:21:00
"531","Excellent overall phone","Great quality phone and back to a normal sized cell phone that can fit in your pocket. High quality camera that takes great pics and videos and some new and cool features only on this phone.",5,2018-09-16 18:56:00
"532","Love this phone!","I love this phone and would recommend it highly. I had an Apple 5C and moved to this phone and it was a seemless transition and easy to adapt to the changes. Love the Camera too!",5,2018-10-12 16:42:00
"533","Great phone","Picked this up for my sister and she loved it. She had the 6 before and this is a really nice upgrade. Just get a good case as the phone is glass",5,2018-12-19 17:36:00
"534","Works great","My Apple - iPhone X 64GB has been terrific. I transferred all my data from my computer to my phone and everything worked just as it should. I am loving it!",5,2018-11-28 21:26:00
"535","It’s good not great","With the iPhone X you have to be an Apple person to make logical sense to overpay for this phone. Some upgrades but it’s really not that impressive for the money you spend on it and knowing that Apple always has a phone coming out and doing tweaking upgrades. If your not an Apple lover and your phone is not smashsed there are better options. I was contemplating returning mine within the return policy everyday and since I’m an Apple person and not broke am rolling with it.",4,2018-03-16 11:25:00
"536","Big fan of iPhones","I am a bit biased because I really like iPhones vs Android. I have had both and I like to be able th Sync to all my other Apple devices. I had no problem adapting to the fact that there is no home button. Went from an iPhone 6 to the iPhone X without much of a learning curve.",5,2018-02-19 11:39:00
"537","iphone","Great phone looking forward to the next upgrade and awesome features to come.",5,2019-04-24 12:51:00
"538","Best Apple iPhone ever made","This is by far the best iPhone ever made by Apple. I only have one complaint which is best buy. They over charged me by 100 dollars and rufuse to refund me and I am an elite plus member.",5,2017-11-15 18:24:00
"539","Great phone","Great, simple, and easy to use phone. it feels good in the hand and it's just the right size. And with Apple, you can't go wrong for the operating system.",5,2018-11-28 16:30:00
"540","iphone x -great phone","iphone x has fantastic screen quality, marked improvement on other models for photographs. It's easy to use and the design is beautiful as most apple products are. Great battery life compared to previous models.",5,2018-07-27 16:22:00
"541","It’s ok","I really wanted to love this phone and I think it is still great. However, for the price tag I was hoping to feel more comfortanle with. The portrait mode is amazing but the touch screen is sometimes too sensitive. I also think this phone is more sensitive to lost reception when compared to others.",4,2018-11-30 19:06:00
"542","I love this phone","Most of the front of the phone being the display screen is a great new feature. It makes a lot of actions more pleasurable (watching movies/shows, looking at photos you take). It still occasionally freezes and glitches but nothing major. The camera quality is intense, super good.",5,2018-02-03 23:37:00
"543","Great Phone for the sales price","Great Phone for the sales price that's only a year old!!",5,2019-05-29 13:29:00
"544","Wife's Phone","She raves about this phone. An excellent upgrade from her previous iPhone which was getting to the point of being unable to hold a charge.",5,2018-12-29 07:41:00
"545","nice","i bought this phone for my daughter and she loves it.",5,2019-06-02 17:31:00
"546","Awesome phone!","Honestly i dont see myself getting a new phone for a while!",5,2019-05-23 09:58:00
"547","Great product","No i had always been a Samsung owner because I found apple phones boring and lacking fun applications. This new phone contradicts all my previous beliefs. It’s fancy, easy to use, numerous fun applications are available and the quality of the pixels is EXCELLENT! Love it!",5,2018-02-21 16:50:00
"548","Perfect","Took some getting used to, but I love this phone.Apple for life",5,2019-05-16 08:14:00
"549","Purchased for our daughter","Must be good since she never seems to be without it",5,2019-01-17 05:01:00
"550","Great IPhone X","I went into Best Buy knowing what phone I wanted, As I always do research about what I want when it’s an investment the store wasn’t busy at all due do the large amount of snow we’d gottten so upgrade my phone was a painless process, the associate who helped me out was good.",5,2018-02-13 07:10:00
"551","Great phone.","Great phone. Price is high though. Needs to be about a third since most of the time you have to get a new one ever 2-3 years because it starts acting up like slowing down, not charging, or other glitches.",5,2018-08-08 18:25:00
"552","Super iphone","The best iphone ever !Best phone I have ever owned! Phone is easy to use and the larger screen is perfect for pics and videos. If you can get this phone please do, you won’t regret this purchase!The Face ID works better than the fingerprint ID and I love not having the home button! Love the iPhone X!",5,2017-12-02 12:35:00
"553","Top mobile phone","This is without question the finest mobile device on the market. The camera is as powerful as my dslr, the facial recognition login is very easy to use, the screen clarity and size are the best on the market.",5,2018-07-28 14:34:00
"554","Oh my...","My wife was very excited about upgrading to the iPhone X as her sister has one as well. The features of the phone are as she wanted, however, within 2 weeks there was bright green line on the screen so we took it to an APPLE store. They had to send it out to be fixed. When it was ready to be picked up we found that they had just sent her a new phone, that should have been the first warning. Now after owning the phone for a little over 4 months the battery is failing. It shows 100%, but unexpectedly shuts off. When you try to turn it on it says that the battery is low. After plugging it in and the phone turns on it shows that the battery is at 100%...Taking it in (again) to be fixed. For the cost of this device you think it would last longer.",3,2019-01-04 21:49:00
"555","the best of the best","I switched from Samsung to this phone, completely different phones ... here are their awards! I sync them with headphones and watches and cars and it is very convenient!",5,2018-10-21 17:36:00
"556","I love the iPhone x","I switch from a Samsung s8plus to this phone because I needed a phone that I could operate with one had I’m handicapped noe and can only use one hand.",5,2018-11-30 12:55:00
"557","Apple - iPhone X 256GB - Silver (Sprint)","I fall in love with it! perfect size, beautiful color silver, nice photos, and video. it was not a sale :(. hope its sale with u soon :)",5,2018-12-28 23:58:00
"558","iPhone X","Finally was able to find an IPhone X threw the Best Buy app. Status said there was only a few left. I ordered it while running errands and received a text message and email saying it was ready for pick up. Very easy and simple instructions were giving to me in a broucher. No issues with activation.",5,2017-11-30 17:39:00
"559","Awesome Sleek","One of the best phones out there. It feels just right in your hands, and it's anApple product, which means works with everything else Apple.",5,2018-12-20 06:22:00
"560","iPhone X","Fantastic Phone! Great display and Functionality. I went from a Note8 to the iPhone X. I have always been an Apple person. They Note8 was great but the iPhone X just feels better in my hand and connects with all my family, friends, and especially my other apple products ie (MacBook, iPad, iPod.",5,2017-12-11 11:28:00
"561","Overall great phone","The iPhone X is incredibly fast, camera quality is incredible, I would highly recommend anyone to get one.",5,2018-08-11 14:08:00
"562","Not bad","Speed is fantastic. Picture is nice. Size of screen is sweet. Only down side is face recognition. I did not like that feature.",5,2019-01-16 19:49:00
"563","iPhone X Upgrade","I upgraded from a iPhone 6 plus. I'm not too happy about there being only one screen size available, but all my issues with bluetooth and lagging went away when I upgrade. So I would recommend the upgrade if your having issues with the older models",4,2018-07-02 01:01:00
"564","Love this phone!","Awesome phone, the Face ID is so accurate and cool. It knows my face in the dark, when I have sunglasses, hair up or down. I love Siri! She is way better on iPhone X. No home button, but it made my phone so much easier now.",5,2018-06-15 20:04:00
"565","Best iPhone yet","I absolutely love the screen resolution and the sound; finally don’t have to cup the speaker to hear the audio. Favorite part is the Face ID",5,2018-04-18 18:07:00
"566","Great phone","I upgraded from an IPhone 6splus, and I couldn’t be happier. The size of the screen and the slim lines of the phone are awesome! The camera takes phenomenal photos! I can’t wait to see what other features I’m missing!",5,2018-06-29 23:11:00
"567","Apple outdid themselves!","I love the size and nimbleness of this iPhone X. I can operate if with one hand. I couldn’t do that with my 7+. I love not having a home button! Facial recognition works well too! The camera is 5 Star!!! Portrait mode selfies are sweet!",5,2018-05-11 20:21:00
"568","Nice upgrade","Still working out a few issues with the phone. Bought two of them with the great deal from Best Buy, but one has not worked as well as the other.",5,2018-12-05 10:47:00
"569","iPhone X","Everything you would expect from an iPhone,even more !!
Fantastic move forward by Apple !!",5,2019-03-20 19:17:00
"570","Love new Animoji feature, just right size phone","The dynamic wallpaper is neat. Animojis are fun, new camera settings are great if you take a lot of pictures or selfies. Picture ID pretty accurate most of the time, not so much in the dark but that makes sense. New swiping gestures are easy to adjust to.",5,2018-03-21 18:34:00
"571","Great gift!","I purchased the iPhone X as a gift for grandpa. He likes it, however does not use many features. I hope that the technology/updates outlast my payments lol.",5,2018-11-10 20:22:00
"572","Getting used to no Home Button","I've already dropped it a handful of times without incident, do wish it was a tad smaller in size to better fit in my pockets. But otherwise great!",5,2018-11-29 17:30:00
"573","It takes some getting used to. Still no aux jack.","It takes some getting used to, but once you're used to it the iPhone X is great. This current has some of the best processors on a cell phone to where everything performs fast and efficient. The only thing you'll have to worry about performing slow is where and what you're connected to in terms of internet and service provider. Still no headphone jack which is very disappointing. This is a great phone for iPhone's new generation of smart phones.",4,2018-04-02 23:15:00
"574","Nice but expensive","Latest in a long series of iPhone's in our family. Good (but probably many unnecessary) features. Daughter likes it, but dad is frustrated by Apple's ""planned obsolescence"" with batteries and other features slowing down after a relatively short period of time relative to other electronic devices we have had.",4,2018-11-02 19:15:00
"575","Great phone","Great phone for anyone who is wanting to upgrade or switch over to iPhones!",5,2019-04-17 23:27:00
"576","Great phone for the money","This is really a great phone. I bought the X outright since Best Buy had some left in stock. I paid a 100.00 less than the Xs. Very well worth it.",5,2018-11-30 18:40:00
"577","Best phone on the market","My iPhone X is my first iPhone always was android user until now. Love the face scanner works every time.",5,2017-11-15 17:12:00
"578","Awesome phone","It is truly a nice upgrade from older iPhones of course they cost more but so far worth the price just hoping it’s lasts longer than previous.",5,2018-12-07 14:27:00
