"","Heading","Text","Rating","Time"
"1119","Good updates","My wife is very happy with the iPhone x. Could use wired headphone jack though.",5,2018-11-29 17:15:00
"1120","Apple iPhobe X","I believe this is the best iPhone yet. I love it. So easy to adjust to no home button. Face ID is a fantastic feature. Pricey ...but worth it for me.",5,2018-05-09 07:17:00
"1121","What's left to say?","Apple never disappoints when launching a new product. That said, I won't need a new phone for a while. This one's great!",5,2018-08-06 22:34:00
"1122","iPhone X","Love it. The facial recognition is awesome. Everything you expect from an apple product (unfortunately, including the price...).",5,2018-07-13 12:23:00
"1123","Awesome phone","Great quality and love it. It is so sleek and very easy to use. Best iPhone yet",5,2018-11-28 16:36:00
"1124","Love the new phone","My husband got the new version and simply loves it and the pictures are much clearer on this phone.",5,2018-10-05 13:32:00
"1125","Great phone","This is a good size phone. Although the screen is a little bigger than iPhone 8 Plus, the overall phone size is smaller than iPhone 8 Plus and bigger than iPhone 8.",5,2018-03-17 15:27:00
"1126","Love Love Love","Love my new phone. It does so many cool things. So glad I made the switch. Victoria at the Best Buy on S Jackson and her coworkers were awesome in helping me transition into the new iphone X.",5,2017-12-08 16:14:00
"1127","Love it","Love the phone. Great display. Great battery and processing",5,2019-01-17 13:37:00
"1128","The iPoneX is awesome.","My new iPhoneX is awesome. It has many added features which will enhance my iPhone experiences. The new camera takes amazing pictures!",5,2018-06-22 13:43:00
"1129","Love it","This is the best iPhone to date. No need for another update",5,2019-01-16 22:17:00
"1130","Still deciding...","I do like many features about this phone, however I am not sure those features take my admiration above that of my previous 7plus. Still adjusting.",5,2018-05-11 16:33:00
"1131","Very nice phone","Very nice phone with all the bells and whistles. Only problem is the notch out of the screen at the top.",5,2018-09-19 17:38:00
"1132","Great phone","Best phone to get no problems with it over a year having it recommended to get",5,2018-11-29 11:05:00
"1133","iPhone X","This phone is great and easy to use. If you are switching from a plus, you just have to get used to the smallness of the phone.",5,2018-07-13 16:37:00
"1134","I phone","The new iPhone was a little difficult at first to get use to but after a week I got it down pat. The pictures are a lot clearer .",5,2018-07-06 14:23:00
"1135","Its ok!","I needed to upgrade iphone 6s so I decided to go for the Iphone X. Though it works ok, I dont think its worth the price. It feels pretty much like any other iphone, nothing great about it.",4,2018-03-21 17:23:00
"1136","the best iphone","Beautiful superamoled screen, easy to adapt and the most premium experience that an iphone can offer",5,2018-09-29 21:32:00
"1137","Best Iphone","I have had 5 Iphones and this iteration was the best improvement. It is a bit pricey but if you use a lot of the features it worth it.",5,2018-06-20 19:15:00
"1138","This is a great phone","This iPhone was what I was waiting on the price finally drop and I copped it.",5,2018-11-30 17:51:00
"1139","One of the BEST iPhones!","this one of the best iphones made. i thought my iphone 7 plus was the best and the X is even better! the camera takes amazing pictures! haven't had any problems with battery life",5,2018-01-21 14:20:00
"1140","Awesome phone","Really enjoy the feel of it and the look. I think it’s a great price as well.",5,2018-11-30 13:13:00
"1141","Love the new emojis, camera is great!","Easy to use, love it! Love the new features of the emojis when you face time.",5,2018-11-30 12:27:00
"1142","Great phone","Bought it for my wife she loves it. The picture quality is really great and the sound is outstanding",5,2018-09-28 17:49:00
"1143","Awesome phone","It is by far their best phone. I was concerned about face recognition but I actually love it. The new features take some getting used to but worth it. Oh and the cameras are amazing.",5,2018-01-05 17:27:00
"1144","Love it","Had iPhone 6 Plus. So it was time to upgrade. Great and easy to use. Best Buy always treats us well.",5,2018-09-28 17:34:00
"1145","The OLED screen is amazing, overall, very fast.","Face ID does not disappoint. It works every time. It is fast enough that you don't even know it happened.

The bigger screen with the smaller form-factor makes this phone a winner!",5,2018-01-05 17:07:00
"1146","Great camera","Love the Face ID better than the thumb print and password.",5,2019-01-17 11:27:00
"1147","Had for a few months","Didn’t buy the phone at launch because of the price point. I decided to get the phone a few months after. I don’t regret buying this phone at all it’s fantastic!",5,2018-03-21 23:55:00
"1148","Great","I like this iPhone just like all the others. User friendly",5,2019-01-16 18:50:00
"1149","Nice phone. If you can afford it.","Face ID works at least as well as touch ID, so no worries there. Screen is great. Size is perfect in the hand. Overall, I like this phone a lot but I do think Apple's pricing is pretty ridiculous.",5,2017-11-10 12:58:00
"1150","iPhone is the way to go!","Best phone. No glitching. Clear screen. Love the portrait photo mode.",5,2018-12-19 18:34:00
"1151","Mesmerizing","I love the all screen! It’s about time apple did something like this.",5,2018-12-19 17:15:00
"1152","Quality","Camera is cool. I’m enjoying the facial recognition and security. Very happy all my charging accessories still work with the X.",5,2018-07-09 11:50:00
"1153","Great phone","The Apple iPhone X is a great phone. Holds a long charge. Does not drop calls",5,2018-11-28 21:05:00
"1154","New iPhone X","I received this as a gift and I love it! The portrait mode camera is amazing!",5,2018-11-28 19:10:00
"1155","Awesome phone","I’m still discovering all the phone can do but so far I love it. The facial recognition actually makes sign into the phone very fast. The photos are great in portrait mode very fun to play with.",5,2017-11-17 21:03:00
"1156","Great product","This camera is very appealing to the eye and receives many compliments. All the functions are exactly what I wanted.",5,2018-08-11 10:31:00
"1157","Awesome","I just love it, the features the amazing photo quality and the difference it has from all the other iPhones is just spectacular.",5,2018-07-05 17:43:00
"1158","Great camera easy to navigate","I’m new to iPhone from android and this phone is easy to learn great camera easy to control apps and put them in a specific order. Overall great product",5,2018-04-18 18:52:00
"1159","Love this phone","If you are an Apple person you will love this phone. I love that the screen is the same as my plus was but that I can comfortably hold the phone in one hand to use now.",5,2018-02-21 17:50:00
"1160","I like it","I upgrades from the 6s and the X has grew on me more and more with each day that I use it. Its a big improvement in terms of speed.",5,2018-06-25 09:47:00
"1161","Great phone for cost","Super excited about the phone. Went each Sunday to try out sales and super happy with outcome.",5,2018-10-12 14:23:00
"1162","Love it","I love my X first iPhone I have ever had and it’s awesome",5,2019-01-17 15:24:00
"1163","Everything they say it is","I was hesitant to spend this much on a phone, as I don't use the camera much.... It was 100% worth it. Image, sound, speed, ease of use.... and I got over the notch within about a week.",5,2017-12-19 11:51:00
"1164","Great iPhone.","Traded my 6plus in and really enjoy this phone. Faster and more reliable.",5,2018-12-07 16:47:00
"1165","iPhone X","So far it’s great, I really had wanted the space gray but they had just sold the last one before I got there. Other than that took a bit getting use to but now it’s easy using this phone",5,2017-12-15 13:42:00
"1166","Iphone","Great phone. Don’t plan on upgrading for a while. No problems with the phone",5,2018-11-29 20:06:00
"1167","Amazing","Just an all around amazing phone. It’s a new experience for iPhones and a step in the right direction",5,2017-11-15 18:07:00
"1168","Great phone, ease of use","After switching from Android, I enjoy the simplicity of this device. Would recommend to everyone",5,2018-10-06 09:18:00
"1169","Nice!","Just upgraded and I absolutely love it. The camera is awesome!",5,2019-01-04 12:32:00
"1170","For my Apple lover","My daughter just loves the Iphones! I purchased this as a graduation gift for her and best buy makes the purchasing process so easy.",5,2018-06-20 17:45:00
"1171","Upgraded","Went to an Apple phone from a Samsung. Still learning Apple stuff.",4,2019-06-20 04:36:00
"1172","Former Android user switched to iphone","My daughter recently upgraded from an Android to an iPhone x she's interested in doing blogging and thought the iPhone x with support her newest endeavors best",5,2018-03-22 10:55:00
"1173","Fabulous X","What a great product. Amazed at how simple using a smart phone can be. Love apple products.",5,2018-10-19 08:29:00
"1174","iPhone","the iPhone X is the most advanced phone I have ever used/works seamlessly with my other Apple products/worth the extra money",5,2018-07-14 07:47:00
"1175","Replaced an iPhone 6","Wonderful display, really like the face recognition. Good price before the latest iPhone releases.",5,2018-09-28 16:18:00
"1176","Amazing phone","Great for me but it’s smaller than the plus that I had. Disappointed in the screen size though, even though it’s bigger when videos play they are the same size as my previous 6 plus",5,2017-12-29 20:27:00
"1177","Great camera!","My phone broke and I really needed one because we were going to be leaving for vacation. So I purchased this new one! Love it!! Camera is amazing!",5,2018-05-03 08:32:00
"1178","iPhone x","This is a great phone and the picture quality is top notch! So much to offer in an iPhone and perfect size !",5,2018-08-30 00:23:00
"1179","New design, interesting way to switch between apps","Iphone x is matching my expectations so far. Costly but it has features n quality. App navigation is interesting. Phone gives better control to user about interface n security",5,2018-01-20 15:23:00
"1180","Great phone","Let me begin by saying, I do not do much besides talk and text on my phone, but the iPhone X has been great. The picture quality is amazing!!! Worth the Money",5,2018-03-22 06:34:00
"1181","Great phone","I have been using iPhones for quite a few years. The X is the best yet. It takes no time at all to get used to “no home button”. Watch some YouTube vids for tips/tricks/shortcuts and all will go smooth. The OLED screen is fantastic. This phone has some flaws, but I’m sure that all cell phones do.",4,2018-04-12 22:49:00
"1182","Great phone","upgraded my apple and am very happy with my choice. Would recommend",5,2018-12-19 19:15:00
"1183","Different but good","no Button makes things awkward almost but how great the phone is kinda makes you forget. Amazing camera and the size reduction makes the phone fit easier in the pocket",5,2018-02-16 15:50:00
"1184","Great screen","The new full screen and resolution are great. Navigation different than iPhone 8 Plus, but doesn't take long to pick it up.",5,2018-07-13 18:45:00
"1185","Perfect","This is my first time purchasing apple products. I am very impressed by the quality and the battery life. The overall layout is awesome.",5,2018-06-02 13:04:00
"1186","Love my new 10","The iPhone X has been great. Sound quality while on the phone is awesome. Pics are perfect although I wish the shutter speed was faster to catch moving subjects. Plenty of features and updates to keep it running great.",4,2018-09-25 08:17:00
"1187","Best iPhone!","I love my iPhone X! I was a little hesitant at first with it not having a home button. But after 5 min I did not miss it at all. Face ID works great and it is super fast! I love it!",5,2017-12-23 23:00:00
"1188","Greatest new phone","Apple makes things better than anyone else. I love their products.",5,2018-12-19 17:03:00
"1189","Excellent phone","I would highly recommend this phone. Very user friendly. Excellent camera.",5,2018-11-28 17:02:00
"1190","Awesome phone","The phone is the best iPhone yet. It takes very little time to get used to the lack of a home button.",5,2018-09-14 16:23:00
"1191","Amazing!!!","Okay, I don’t want to sound like an Apple fan boy but this is definitely the best phone they’ve greater design wise. Reminds me of the iPhone 3GS but smaller and more technological advanced.",5,2017-11-15 18:04:00
"1192","Love this phone","This has exceeded my expectations. I love this phone!",5,2019-01-21 09:38:00
"1193","Fantastic","When I first received my phone I was like wow no home button how is this going to work out but it has worked out in the end I love my phone and I would buy it again",5,2018-02-21 18:05:00
"1194","Good phone","Good phone with good resolution. I would buy it again.",5,2019-01-18 12:31:00
"1195","Love it so far!","The iPhone X has been great thus far. Great pics! Getting used to differences from 7s. Love the face recognition.",5,2018-08-09 03:21:00
"1196","Love this thing","X is a great new design, the Face ID was actually much easier to adapt to than I thought it would be",5,2018-09-16 14:58:00
"1197","Great phone","My daughter loves this phone. Great iPhone. Very jsppu",5,2019-01-17 17:26:00
"1198","Best phone","I have had many phones and this is the best phone that I have ever owned.",5,2018-11-29 10:44:00
"1199","She loves it !","My daughter loves her phone she traded in her iphone 7 for the X and coudn't be happier .",4,2019-05-10 12:25:00
"1200","Best iPhone yet!","Not having a home button takes a little getting use to but I like it better now that I’m use to it. The iPhone X has an outstanding camera and many other features I love!",5,2018-01-26 23:16:00
"1201","Great","Nice phone . Also camera quality is too good . Awesome",5,2019-01-16 20:36:00
"1202","easy use","i bought it to replace my old 6 ,that apple had slowed down , this one seams to run quite well , leave my phone alone apple , it works just as i need it to",5,2018-03-22 05:27:00
"1203","Great Apple Product","Definitely has not disappointed. Upgraded from 8 Plus.",5,2019-01-16 17:34:00
"1204","Best iPhone Yet","This is the best iPhone yet. I like how the phone is smaller the the plus sized phones, but the screen is bigger. The facial recognition is pretty cool too.",5,2018-03-18 08:31:00
"1205","Love this new phone","My first iPhone, wow, it’s just a great phone, apps, sound, ease of use. Nothing to complain about al all.",5,2018-08-27 09:40:00
"1206","Love my phone","My only complaint with this phone is that the screen goes black during calls and it’s hard to dial or end a call! Also Bestbuy mobile never gave me $25 each they promised me for 3 phones!",4,2018-11-19 14:26:00
"1207","Great feature phone","Love the Iphone X, great camera and battery life is really good. Screen is beautiful. Like the emoji feature where it mimics your facial expression.",5,2018-04-14 12:01:00
"1208","Best iPhone yet","The iPhone X is the most powerful beautiful phone they have ever created. Not having a home button is not even an issue since you get so use to how fast using the home bar is.",5,2018-01-06 07:03:00
"1209","Awesome security features","Good security features like facial reconition,camera megapixel are expansive,cool extra applications are fun.",5,2018-08-17 13:36:00
"1210","Love it","Took some time to get used to no home button but now i don’t even know why we had one in the first place",5,2018-08-31 21:14:00
"1211","Great Phone","I really love my new cell phone. I was looking for a great camera that made phone calls. I found it!",5,2018-09-12 15:43:00
"1212","Great phone","This is a terrific phone! Only problem I had was having to leave Best Buy to go get a SIM card at Verizon and then return back to best buy",5,2018-05-16 22:01:00
"1213","The X is now!","I love this phone. I thought I would miss the home button but now I never want one again. It is super fast, sexy, and as with everything Apple, reliable. Great phone.",5,2018-02-07 16:29:00
"1214","Battery still does not keep a good charge :(","Love the features of the I phone x. 
But whole reason I upgraded was because my iPhone 6 Plus battery and now having same problem with this. Maybe last half of day if I am lucky without having to charge. 
My boyfriend has 8plus and he can stream and play games watch videos full day with out having to charge. 
Disappointed.",4,2018-01-17 17:23:00
"1215","Very nice phone","Super nice phone.. Highly recommended. Bestbuy staff quickly unlocked the phone for me. Thanks!",5,2018-09-26 11:19:00
"1216","Love it!","Fast easy to use. I have all apps products so pairing was easy.",5,2018-12-22 12:58:00
"1217","Awesome phone","Way faster than my previous phone and lots of Storage",5,2019-01-17 01:59:00
"1218","A lot of new fun things","Pictures are great! Enjoying a lot of new things! Everything is working fast and better than my old phone!",5,2018-08-24 13:03:00
"1219","X","By far my favorite IPhone, I just love everything that I can do with it!",5,2018-11-28 17:07:00
"1220","Awesome!!","If you love Apple products, and you're due for a new iPhone, this could be the one! The display and design is just so gorgeous. iOS is of course top notch, and you can't be Apple quality.",5,2017-11-16 10:33:00
"1221","Love it","Great phone love the anemojis and the no button feature. An aux adaptor is included :) excellent phone runs fast easy to use. Thank you apple",5,2018-05-04 23:04:00
"1222","Love it","I upgraded to an iPhone X and I’m happy, great phone!",5,2019-01-16 19:08:00
"1223","Iphone","I absolutely love my iPhone! It was the best purchase",5,2019-01-16 17:24:00
"1224","Great iPhone","Love this iPhone. Took a little while to get used to not having a home button, but the other features make it all worth it.",5,2018-07-02 11:02:00
"1225","Best iPhone yet","The product is great; however very expansive. I had a BestBuy gift card from my credit card points to help off set the cost. I purchased it out right",5,2018-04-06 12:22:00
"1226","Great phone","I bought this phone as a gift for my son who needed a phone.",5,2018-12-29 10:24:00
"1227","iPhone so yes","Its an iPhone so yes it functions smoothly and seldom any issues or data breach but expensive",5,2018-09-30 10:21:00
"1228","Another Quality Apple Phone","We are a Family of Apple products and after the initial trial of realizing there is no home button; Love the Phone and all of the new features. Wouldn't change a thing.",5,2018-01-26 15:43:00
"1229","Love this phone","Love my iPhone x, Has a great camera And a large screen size",5,2018-12-28 14:46:00
"1230","Great Phone","Love the face ID and how fast the phone responds. The screen is just as big as the plus and the phone is easier to hold. The camera is phenomenal.....so happy that I upgraded",5,2018-01-03 05:52:00
"1231","Great Phone As Always","Apple has always made great phones and the iPhone X is no exception!",5,2018-12-07 13:59:00
"1232","Love my replacement phone","Apple had to replace my first I phone. The new one works great.",5,2018-12-20 11:44:00
"1233","Best Iphone on the Market for its price!","I fly drones for a living and and i DID not want a Ipad and have to add on a extra service, so I deceided to go with the new IphoneX. 
i LOVE this phone due to the following: My screen size of 5.3 inches which is perfect for me. The Screen resolution is @ 2436 x 1125 which is off the charts and it has 256 GB Storage. It fits perfect into the Dji Controller with the PolarPro attachment. Also, the The Go Pro aPP is lighting fast for the Dji Drone app.. I could not be more happier... The look of the phone is top notch and the quality is definitely solid.",5,2018-11-03 13:42:00
"1234","Always the best","Best buy always have what i need and what i need, love it",5,2019-01-04 18:31:00
"1235","Great Product/ Great Price","This product was a great addition to my new I-phone. Not only was it priced right, but it is also cool looking.",5,2018-08-06 07:11:00
"1236","Perfect phone","We were eligible for a upgrade and got this phone for a perfect price.",5,2018-12-01 12:43:00
"1237","Go product","Bought this phone while back and it’s still working like a champ. Glad this phone is not big as Plus sizes were with the 6 and 7.",5,2018-06-09 12:16:00
"1238","Upgrade","Love my new upgrade. Best decision over! No regrets.",5,2019-01-16 22:07:00
"1239","Nice product","Smaller size but still large screen and sure is cheaper that the new iPhones that just came out",5,2018-09-21 16:29:00
"1240","Excellent upgrade","It was quite a leap from the iPhone 6Plus, but far easier an adjustment than anticipated. Beautiful photos and videos!",5,2018-07-13 16:20:00
"1241","It’s pretty cool","Love the edge to edge screen! Lots of GBs to store all of my music. Transition from the fingerprint Touch ID was easy. Overall it’s pretty cool!",5,2018-04-18 18:53:00
"1242","User friendly","Absolutely love this product it’s very easy to use and it comes with a lot of memory.",5,2018-10-19 08:24:00
"1243","Best iPhone yet!","The facial recognition is not the only great feature that sets the iPhone X apart from 8! The larger screen is great with no home button to press for added convienence.",5,2018-01-20 17:57:00
"1244","Best of all Time!","Perhaps the best iPhone made to date. This phone was the change the lineup needed and boy is it refreshing. The full screen display is beautiful and all the features are awesome.",5,2017-12-12 09:48:00
"1245","Good phone","My wife likes this phone for the most part. It has a better camera than her old iPhone 6. But she complaines of the Facebook app kicking her off and the only way to fix it is shut the phone off and turn it back on.",4,2018-09-19 18:23:00
"1246","More than a Great Phone","This is my first smart phone. I have had it for about two weeks and am completely happy! It can do so much more that make phone calls. I am continuing to learn all about it.",5,2017-12-30 14:43:00
"1247","Best phone ever","I love this phone! It’s perfect for me. Fast and perfect size.",5,2018-12-19 20:20:00
"1248","Best iphone","This is the best iphone i ever had. Very reliable !",5,2019-01-16 22:19:00
"1249","Best iphone","This is the best iphone i ever had. Very reliable !",5,2019-01-16 22:17:00
"1250","I love my iphonex","Great camera, and the right size screen as well. Miss the home button, but you get used to it.",5,2018-09-21 17:51:00
"1251","Great phone","An amazing phone with a lot of great features. Love it.",5,2019-01-06 13:54:00
"1252","great phone","it is a great phone. i like the extra cool features like face id.",5,2018-12-11 10:15:00
"1253","Great phone","Was hard getting used to but when you do is miles better than the iPhone 8. The camera on this is insane. Ten stars !!!",5,2018-07-06 20:32:00
"1254","good phone","Nicer screen, better camera, overall a great phone",5,2019-01-18 16:29:00
"1255","It’s worth the wait","I waited and debated on purchasing this device. I’m glad I purchased it. It took a little bit of a learning curve on using the facial recognition but I am enjoying the feature.",5,2017-12-15 17:27:00
"1256","good pictures","It was a little hard to get use to the phone after having a 7Plus and without the home button but now I love it.",5,2018-07-27 16:18:00
"1257","Nice","good experience buying the handset at best buy and got approved for my best buy card right away. 
Thank you best buy",5,2018-07-11 16:51:00
"1258","Great phone","One of the best phones I have ever owned!!! Great pictures!!!",5,2018-12-19 22:07:00
"1259","Best phone","Best phone ever, I would recommend these iPhone with no doubt",5,2018-12-19 20:00:00
"1260","Love my phone!","Love this phone! Hope is continues to work well. Easy to use.",5,2018-12-19 18:35:00
"1261","Awesome phone","I love the retina scan that allows you to quickly unlock your phone.",5,2018-11-30 21:12:00
"1262","Great IPhone","I love my new Iphone x, the best camera and design",5,2019-01-16 18:40:00
"1263","Awesome phone!","This phone is great! I love it! Works perfect and has lots of memory",5,2018-11-30 11:39:00
"1264","Upgraded phone","My girlfriend wanted to upgrade her phone also since I upgraded mine and she's been a fan of it ever since. It isn't too big for her hands or too small.",5,2018-03-12 13:34:00
"1265","iPhone 10x","Great phone. Slim and has a great camera. I would recommend to a friend. Can’t wait to see what phone is next",5,2018-08-03 16:03:00
"1266","Great phone","Love the phone great pictures and quality have not had a problem yet",5,2018-11-29 06:05:00
"1267","The best iPhone yet","If you have taste for the best, this is the phone you want. From the Face ID to the seamless all screen design no phone comes close to it.",5,2018-04-28 09:10:00
"1268","Nice phone, VERY Pricey","Facial ID works well. The phone tends to ""freeze' occasionally. I would prefer the home button to the swipe up feature on the iPhone X.",4,2018-07-21 12:08:00
"1269","Great phone","Best iPhone ever, fast, great camera. Lot of space. Love this phone.",5,2018-11-28 17:02:00
"1270","FANTASTIC UNIT","FAST, CLEAN, LOVE THE FACIAL ID - HIGHLY RECOMMEND THE 256G",5,2018-12-22 13:57:00
"1271","IPhone X Upgrade","Greay experience to upgrade my phone to the new iPhone X in the store! Phone is very easy to use and feels lighter!",5,2018-07-13 06:36:00
"1272","Easy to use. Perfect size.","The facial recognition is fantastic. This is my first iPhone and I wish I had changed years ago. All the features are easy to understand and access.",5,2018-03-23 15:23:00
