"","Heading","Text","Rating","Time"
"1","Very happy so far","Have spent a few days with the device. It is definitely pricey, but from the user experience point of view, I am pretty happy with the device so far. Here are a few things:

1, The Face ID works well 99% of the time. Pretty responsive, too. For those with glasses I would suggest capture the FaceID with glasses off. 

2, I like its front camera portrait mode. Could take much better selfies. The stage lighting portrait effect could use some improvement, though. The rear camera works better than the 8plus/7plus in low light situations, and generally provides greater contrast and details. 

3, The size is just right. I feel the 8plus is too big, but this one is just about right. I do prefer the size if used without a case, but there's no way I am doing that. The phone has a sleek look and nice finish. Stainless steel frame gives it some extra shine. 

4, It definitely needs a case to protect its fragile glass back. 

5, the wireless charging is a plus. But it charges rather slowly, since I mostly use the iPad USB charger. 

6, the OLED screen is gorgeous. Better images all together. Apple says it helps save battery life. I will see about that. 

Verdict: if you are on the fence between 8Plus/8 and X and have the extra budget to spare, go with the X.",5,2017-11-06 22:54:00
"2","Great phone!! My first IPhone","This was my first IPhone purchase and I have really enjoyed it. I still think the galaxy camera is better. I have seen them side by side at a concert and the galaxy performed much better especially with low light and stage light changes.",5,2019-11-29 16:24:00
"3","Cool phone for avid users","Great battery life and the most advanced camera I’ve used on a art phone. I use a lot of professional cameras (Canon, RED, etc.) and this phone has one that is perfect if i don’t want to lug around a big DSLR!",5,2018-08-10 12:58:00
"4","iPhone X","Great phone. Easy n fun to use. light weight. Love",5,2019-02-01 12:42:00
"5","Great camera,sound and fast","Eszy to use with one hand and screen look cool, sound good...",5,2017-11-11 01:02:00
"6","A great phone","The phone is great!
It has an outstanding camera and the processor speed is the best I’ve ever seen.",5,2019-01-17 06:19:00
"7","What a great phone!","I am currently using my new iPhone X to write this review!! This phone is amazing! The screen is bigger but the phone is not that bulky which is + for me ! The camera is a a total success! Thanks apple!",5,2017-11-17 08:01:00
"8","Is a nice phone","It tak a lot of time to unblock the phone and you literally have to steering at the phone 
I think finger security was 10 tim s better",3,2018-07-27 17:24:00
"9","Solid option","I’ve been using this phone for a little over 2 weeks now and finally feel ready to review it. First, if you’re familiar with iPhones you will have to go through a learning curve to get used to the changes in how you’ll need to use gestures to do what you’ve been used to doing before now. Don’t worry though...you adjust quicker than you can imagine and will find yourself “forgetting” how to do things the old way when you pick up an older iPhone afterwards lol.

 Losing the home button is not as traumatic as some seem to think. Face ID is fast and has been pretty spot on for me. Coming from a Plus model will take some time to adjust to. You will feel like the phone is significantly smaller. You’re right to a certain degree. The extra body you’re used to with the top and bottom bezels make you feel like you’re downsizing but you have to remember that the X screen is bigger (technically) so you’re mainly just loosing the extra none usable space (other than the home button since that was absolutely usable). The X screen is longer but slightly less wide the Plus models. As apps slowly start to update and utilize the full screen your experience gets better. Until then some people will complain and want to bail on the X after just a little handling time. Ultimately you’ll have to handle it and see what your patience level is to see if this phone will work for you. 

The notch...its heavily debated and will bug some people. Again, it’s something you have to gauge for yourself because what bothers you may not bother me (I don’t mind the notch or the size for example). 

Camera is great as always. Some features are more gimmicky than others (Animoji for example is entertaining but not something I’ll likely use much) but as with every phone on the planet some things are just fun perks that may or may not be used. 

The glass...has some people extremely nervous. The answer for that is pretty simple...invest in a case if you’re concerned. I personally almost always use a case so it doesn’t bother me. I didn’t have a case for the better part of the past 2 weeks, dropped my phone a couple of times, but didn’t experience any cracks or anything. But I’m generally careful with my devices so I’ve never experienced a crack (knock on wood). I would suggest investing in AppleCare or insurance if you’re worried about repairs though because the cost is more expensive than ever (check the Apple website for info). Again, that’s a judgement call. It’s not a requirement but if you know you tend to be rough on your devices and don’t want to have to pay expensive repair fees you would benefit from getting AppleCare or some other coverage. 

Ultimately, I truly enjoy my upgrade to the X. No issues so far. The size is great to me but yes, it took some time to get used to. The gestures are super easy. And Face ID has been more accurate than Touch ID for me (not that Touch ID was a problem. It just had issues registering my fingerprint at least twice a day. FaceID has only failed me if my eyes weren’t open or if the phone isn’t able to see my face because of where I am when it tries to scan me). But overall I enjoy the X and think it was a perfect upgrade for me.",5,2017-12-08 17:32:00
"10","It doesn't get better!","This is the best phone I have ever owned! I just switched from Android to iPhone. One thing that kept me from switching is that I never did like iPhone's physical home button. The iPhone X changed that. Honestly, I purchased this phone for the high quality camera. I sold a bunch of pro camera gear to buy it. Not only is the camera amazing, with a lot of features I've never even knew existed, the phone just plain & simply operates so smoothly. 
Pros: amazing camera, fluid like operation, everything just makes sense, phone is fast, screen auto adjusts to lighting conditions, dual speakers, phone call quality is fantastic, the colors are amazing, I liked how in case of emergency, help can access your medical conditions and blood type without breaking into the phone, apps operate smoothly, it's pocket-able, the screen size is perfect (not too small or too big), some apps have more built-in features on iPhone than Android, 
Cons: The only thing that I can think of at all is the price but then again, this is like carrying around a mini mac book pro in your pocket. 
If you're ever in the San Marcos TX area, go see Wesley on the weekends. He is their Apple expert. I don't think there is anything that he doesn't know. I went to him 2 weekends in a row asking him questions before pulling the trigger. It's one of the best purchases I have ever made and I'm an extremely frugal guy. I can honestly say that I feel good about the purchase. And for anyone interested in knowing this, because I wasn't sure of it myself, I purchased this iPhone unlocked and took it to my cell phone carrier Metro-PCS and it works amazing! My friend has an iPhone on Sprint and we've done tests side by side and mine beats his every time.",5,2018-09-22 19:26:00
"11","Samsung to iPhone","Was a Samsung guy since the Galaxy s4, bough a Note 8 when it launched. I found myself tired of constant apps quitting, slow speed, and other miscellaneous errors. Decided to grab an iPhone X and I can go on and on about how impressed I am, the new iPhone X and the operating system blows Android and Samsung so far out of the water, that I decided to purchase a MacBook Pro (currently trying to sell my Lenovo Y700), personally i like my MacBook just as much as my Lenovo running Windows 10 Pro but because of how impressed I am with my three week old iPhone X I purchased an Apple Watch Series 3... wayyy better than my Samsung Gear but at a slightly high price.

Pros: Smooth, Stylish, Fast, Reliable, Efficient, Jaw-Dropping Camera, works perfectly with my MacBook Pro and Apple Watch

Cons: I wish they made a ""Plus"" version, I am a fan of the Note 8s huge screen, and although the X has less pixel density it has a much higher contrast and color which provides a better picture... would complain about the price but my Note 8 costed the same (Note 8 is overpriced)",5,2018-04-20 23:31:00
"12","Finally iPhone with OLED!","Been waiting for so long with an iPhone with OLED screen. This phone takes a little getting used to when it comes to no physical home button or fingerprint scanner. But I noticed Face ID literally works 95% of the time every time I try it. The speakers are louder on this phone and also somehow my Bluetooth headphones seem to get louder also. The battery life is even better than the 7 plus I had. It also feels way better in your hand I recall dropping my 7 plus on my face countless times or not being able to reach every corner of the screen without using reach assist. Overall this is a really good phone",5,2017-11-11 01:42:00
"13","Best Device so Far....period","It's expensive...I know, I get it. But if you live on your device for work and personal reasons like me you want to drive a Ferrari -if possible. 
This device is a Ferrari! The processor is quick and responsive, the screen is brilliant and the exterior looks and feels very high end.
If you can afford it ( trade in your existing device!) you should treat yourself to this incredible machine...",5,2017-11-10 14:00:00
"14","Love the smaller footprint of this phone!","iPhone has done it, made the perfect phone for me. This replaced my iPhone 7+, which I had because of my 45 year old eyes. However, it was too big for my smaller hands. This iPhone X is perfect for me. The screen seems to be about the same size, but the phone has a much smaller footprint. I am so glad to finally have the phone I have wanted. This phone takes great pictures, and the gestures are very easy to figure out, I do not miss the home button at all. I have had the phone for 3 days. The battery lasts all day, I take it off the charger at 5:15, and when I put it back on the charger at night at 10, it is at like 40%. Face ID works most of the time, and I do find it better than using my finger. I think if you are on the fence about this iPhone 10, just go and play with it a bit at the store. It really is an awesome phone. I would also like to say that getting the phone at BestBuy and working with their phone people was the best. So much better than the service I got at the Verizon store. I highly recommend the iPhone X and BestBuy!!!",5,2017-11-12 09:12:00
"15","Great iPhone once again.","Awesome design and quality, feels so smooth in your hand. I have owned it for a couple years now and have zero complaints, I now have it to my
Wife and the phone is still working flawlessly with zero issue, no cracks or scratches. One of the best iPhones I have ever owned, and I have been with Apple since the iPhone 2g.",5,2019-12-05 22:58:00
"16","Worth the money","Earlier, tried all different apple iPhones older than iphone X. This one is definitely better with a Face ID. Large screen. Excellent camera. Magnificient screen display. Easy to use. With new discounts coming up every week at best buy and at other retailers, we should definitely get this one. Worth the money you pay for.",5,2019-07-22 14:49:00
"17","Meh, not worth the price...","I was on an iPhone 7+ and decided to move to the iPhone X when my daughter upgraded her phone to an X. I really didn't like it, which is disappointing. 

I liked the face recognition, but it wasn't perfect and without a fingerprint scanner, at times I had to maneuver the thing around my face to get an unlock. The notch didn't bother me at all but the narrowness of the screen really played havoc with watching video. You either dealt with a smaller window with bars or used the zoom for full screen but lost part of the picture. 

Another frustrating thing was on the iPhone X, you no longer have the ""Zoomed"" display option. I always ran my 7+ in Zoomed mode to slightly enlarge all the text and icons. Since that doesn't exist on the X, I felt like I downgraded to a smaller iphone 7 and it became annoying.

In evaluating things, I really didn't really feel like the price was worth what you get, especially for the 256gb version. It's just not worth the $15/mo extra premium above the iphone 8+ to me. At the end of the day, I decided to return it and I eventually went with the Galaxy S9+.

I'll probably take another look at the X series in an iteration or two, once Apple figures it out better with a bigger version and brings the price down to more comparable levels.",3,2018-03-31 20:01:00
"18","Love the design, but already problematic in cold","I've had every iPhone from 4 up to 7, then sprung for this one. The battery life for all iPhones I've had is much worse in the very cold weather -- yesterday, the first cold day in NYC this year, the battery died 99-0% in less than 30 minutes outside.

Still an amazing phone, but beware of that issue.",4,2017-11-11 11:28:00
"19","My first Apple phone","I was an android fanboy and never thought I would go Apple. After paying $800 for an S8+, using it for 6 months only to have it slow down and glitch through animations, I thought where do I turn now. I traded the phone in and decided to give the new notch phone a try for the 14 day return period. I was initially shocked at what experiencing a true “buttery” UI was really like. This phone is so smooth, extremely fast and the animations have never dropped a frame. The gesture based UI is natural and a smoother, chill way to use your phone, rather than hunting for a button to tap and then tapping it. You just swipe around in different ways and at some point you will do it without thought. I’ve had this phone over a year and it’s operating the same as the day I unboxed it. Expensive phone but I don’t see myself upgrading for a total of three years use, where I was itching to upgrade an android phone after 18 months. Yes, buy this phone.",5,2019-02-17 16:53:00
"20","Almost Perfect!","Of several iPhones I’ve owned over the years, this is by far my favorite yet. It is fast and sleek, durable (it’s been dropped without sustaining damage...with case and tempered glass screen protector of course), the display has brilliant colors, the camera has crisp resolution and many advanced features, and on top of all this it’s small enough to easily fit in a pocket or small purse.

Why four stars instead of five? This model is missing one critical feature that my last iPhone had...fingerprint recognition. I don’t care for facial id (my son is sneaky and can hold it up to my face unexpectedly for unauthorized access) so I use a 6 digit passcode instead. This comes with a trade-off though; the lack of a home button at the bottom of the screen provides more usable screen space in a smaller package. If Apple could simply use a rear button like its competitors for fingerprint recognition, this phone would have a solid five star rating.",4,2019-07-19 12:21:00
"21","A Powerful Device","I have had different iPhones and by far iPhone X is the most powerful one. The battery is perfect and the camera is awesome. highly recommended.",5,2020-01-10 20:29:00
"22","Love my phone!","It is almost two years that I purchase this phone form BB and I got to say there has been no issues at all, love my phone and the fact that I was able to go and get it in a breeze",5,2019-12-23 11:28:00
"23","I like it.","I bought this model phone when it came out, and it was solid until I dropped it, putting it in my pocket.  It was in a case and there was no outside damage but something happened inside.  The Wifi and Bluetooth stopped working. I choose to pay it off and replace it with the same phone in a different color.  I'm happy with my decision and have had no issues with the new one.  I'm planning on not upgrading and going to rock this one for a while.  This phone is amazing.​",5,2019-08-02 16:49:00
"24","Best phone for the money","Did a bunch of research and the consensus was that iPhone X was a better deal than xr or xs and that proved to be true. Best Buy had a really great price but much more important was that they were able to help my daughter set up her new phone. They also gave us fair trade in gift cards for the old phones. Only issue was when Verizon tried to charge us a monthly payment even though I paid cash in full. Better communication between Best Buy and Verizon would’ve been helpful.",5,2019-07-12 21:44:00
"25","Great iPhone","My wife loved this iPhone X and it worked and lasted great for 2 years until it was time for a free upgrade.",5,2020-01-15 10:05:00
"26","Great battery life","This phone is definitely a step up from my last (Samsung galaxy S8) and from other iPhones. I had an iPhone prior to having the Samsung. I originally switched to Samsung because I was tired of the same boring iPhone that hadn’t been redisigned in years, and I’m happy to say that the newer models are definitely different and better. The battery life is something else though, very powerful!! I use it the same amount that o used my old phone, and it lasts most of the day without a charge and heavy use. The camera is great, but takes some getting used to. The phone itself is also beautiful, I hate to put a case on it cause I like to show it off, but alas I can’t afford to break it after purchasing this with cash! The price a downfall, but I also purchased the 2 years of apple care and I’m always pleased with what their customer service is like.",5,2019-01-12 09:12:00
"27","Love it","I have been using this phone for over a year now and I am still impressed. Battery life is better than the previous models.",5,2019-12-26 12:49:00
"28","Good phone","Apple keeps coming up with great features.  Would highly recommend",5,2020-01-27 13:27:00
"29","Great phone","I still have this phone and no plans of trading it. Great phone",5,2020-01-25 23:57:00
"30","Good phone","Was purchsed as a gift for someone.   So far no complaints with this phone.",5,2020-01-17 12:40:00
"31","Love Apple Products","After using other cellular brands, none have compared to the stability and quality Apple phones provide. For those reasons, when I upgraded from Iphone 6 I stayed with Apple to their Iphone X. The performance, screen quality, and having a complete screen on the front of the phone is awesome. I also like the wireless charging capability, though I would have liked to receive a wireless charger with the phone. So far, after owning it a month or two, it has been excellent. No complaints about my purchase and enjoying my experience. I just hope I don't drop it!",5,2019-03-31 16:03:00
"32","My girlfriend likes, scratch that, loves her new X","I purchased this for my girlfriend as an early Christmas present. She was upgrading from a regular 6 and couldn’t be happier. The Face ID feature really is a game changer. If you think you will miss Touch ID, don’t, and here is why... It has a feature that will automatically quiet notifications, rings, and alerts when it knows you’re looking at the phone. Super cool! No need to silence an incoming call right away. Also, whenever you open an app you no longer need to place your finger again. It automatically recognizes that it’s you and unlocks the app. You can also easily reply to a text right on the lock screen because the phone has already recognized that you are the authorized user. The gestures are really simple and accurate. I got myself one too. It was an upgrade from a 7 256GB. I hated the 7. Had issues all the time. This phone solved all of that!",5,2017-12-31 08:26:00
"33","iPhone gets better and better","I've been with Apple and iPHones for most of the generations. So I'm used to the functionality and nothing surprises me. With this new edition, I love the enhanced resolution of the video and pictures. The camera is quite better than its predecessors, but I figure that's what is expected from Apple with them competing with Samsung and others. The thing that I'm getting used to is the lack of home button on the face. Instead, Apple has the user swiping up from the bottom. The Face ID has it's faults such as not recognizing the face to its full capacity when it's dark or I have sunglasses on. I think there are minor tweaks I can make to the settings. All in all, I like the phone and continue to use Apple iPhones over the others.",5,2018-12-18 13:43:00
"34","iPhone gets better and better","I've been with Apple and iPHones for most of the generations. So I'm used to the functionality and nothing surprises me. With this new edition, I love the enhanced resolution of the video and pictures. The camera is quite better than its predecessors, but I figure that's what is expected from Apple with them competing with Samsung and others. The thing that I'm getting used to is the lack of home button on the face. Instead, Apple has the user swiping up from the bottom. The Face ID has it's faults such as not recognizing the face to its full capacity when it's dark or I have sunglasses on. I think there are minor tweaks I can make to the settings. All in all, I like the phone and continue to use Apple iPhones over the others.",5,2018-12-18 13:41:00
"35","Great step up from past iPhones","Having had the previous version of iPhone, this one is incredible.  While having the button on the front, takes some getting used to the largest issue is the that the facial recognition takes a little longer than the old fingerprint scanner.  But that’s minor and in time, I’ll get used to that.  But the speed, storage and other features more than make up for it. Nice phone.",5,2019-06-24 10:57:00
"36","Enjoying my new phone","I love it my new phone. Great quality and easy to use.",5,2020-01-17 16:33:00
"37","Go apple","Another great Apple device. Had no issues since purchase",5,2020-01-16 05:28:00
"38","iPhone X","My review of the iPhone X is great I love the phone have had 0 problems with it performs great very fast the facial Recognition Is super great saves me a lot of time and it can be used for other things like I use it to log into my bank accounts my credit cards and so on I got the 256 gn so I would never run out of storage I’m ready to upgrade soon as a new iPhone comes out I just hope it’s as good as this one",5,2019-05-31 16:13:00
"39","Great phone for a switch from Android","I'm usually a bit skeptical when phone companies come out with new features such as face unlock and mobile payment as they can have issues either in execution or adoption. When android first came out with a face unlock feature it was extremely sensitive to light and the contactless payment was not as widespread as it is now. Well 4 years later it looks like Apple has ironed these out and I can gladly say I'm very happy with the facial recognition in this phone. Was waiting for Apple to finally do something that was new, and they delivered spectacularly. Here's to hoping that I can keep the screen intact for the next four years given the cost of this compared to my last two Android phones.

Well worth the purchase!",5,2018-02-20 15:31:00
"40","It’s a good phone!","Okay I’m old school moved up to this phone from an iPhone 6 as it fell in some water and was able to recover. This phone is very nice not the most happy with the glass back but put a slim case on it to protect. Still need to figure out all it’s features as I haven’t even loooked them up. I got it for a gr8 deal from bestbuy 750.00 for the 256gb if u paid all up front which I did. These are limited as they are older but don’t hesitate as they have a better display than the XR",4,2019-08-24 10:03:00
"41","Great ! Switched over from Galaxy","I missed my Samsung at first. There are a lot of features on the Samsung I used to use on a day to day basis that are not a thing on the iPhone.. things I took for granted. I decided to switch because of the ease of using Siri and iMessage. I got tired of screaming “Okay Google” and it not working. I’ve gotten used to the iPhone. It’s way easier to handle.",5,2019-06-22 13:28:00
"42","iPhone X favorite apple phone so far.","I’ve been using an iPhone since the five. I also have a Mac and I like how I can share data between everything with I’ve been using an iPhone since the five. I also have a Mac and I like how I can share data between everything with ease. I like in iTunes where you can do a complete back up the phone similar to the old BlackBerry desktop manager. People don’t realize the iCloud does not backup everything.",5,2019-05-17 12:58:00
"43","Great Camers, Battery Life, Looks etc.","This is probably one of the most beautiful phones I have ever owned. The camera is great, the battery life is excellent and it looks very good. The size is small enough to be comfortable in one hand and large enough to watch videos and play games.",5,2017-11-19 22:56:00
"44","Beautiful screen!!","Beautiful screen and camera! Different card so be sure you get compatible or it won’t activate. Very nice phone and camera!",5,2019-09-14 11:21:00
